label	1st	2nd	3rd	4th	5th
ก๋วยเตี๋ยวผัดไทยเจ	กต.ต้มยำเจ (0.93)	กต.ราดหน้าเจ (0.90)	กต.หลอดเจ (0.78)	ส้มตำเจ (0.72)	ต้มยำเจ (0.68)
แกงเขียวหวานเจ	ผัดกะเพราเจ (0.91)	ห่อหมกเจ (0.89)	ต้มยำเจ (0.89)	ขนมผักกาดเจ (0.86)	ส้มตำเจ (0.85)
ปลากะพงมหัสจรรย์	ปลากะพงแป๊ะซะ (0.38)	ปลากะพงสามรส (0.38)	ปลากะพงผัดฉ่า (0.37)	ปลากะพงนึ่งบ๊วย (0.24)	ปลาเปรี้ยวหวาน (0.23)
ก๋วยเตี๋ยวทรงเครื่อง	กต.หลอดทรงเครื่อง (0.76)	กต.หมูสับ (0.73)	กต.ผัดขี้เมาหมู (0.64)	กต.ราดหน้าปลาหมึก (0.64)	กต.ผัดขี้เมาไก่ (0.63)
ผัดเห็ดรวม	ผัดเห็ดรวมเจ (0.67)	ผัดผักรวมมิตร (0.60)	ผัดผักรวมมิตรหมูกรอบ (0.56)	กะหล่ำปลีผัดน้ำปลา (0.54)	ถั่วฝักยาวผัดพริกขิงหมูกรอบ (0.53)
กุ้งส่วน	แกงป่ากุ้ง (0.71)	ต้มข่ากุ้ง (0.70)	ทอดมันกุ้ง (0.68)	แกงเขียวหวานกุ้ง (0.65)	กุ้งส่วนกะทะร้อน (0.64)
น้ำส้มคั้น	น้ำตะไคร้ (0.14)	กาแฟเย็น (0.12)	กาแฟร้อน (0.10)	ไอศครีมกะทิสด (0.04)	น้ำผึ้งมะนาว (0.02)
ก๋วยเตี๋ยวราดหน้าปลากะพง	กต.ราดหน้ากุ้ง (0.82)	กต.ราดหน้าปลาหมึก (0.78)	กต.ผัดขี้เมากุ้ง (0.75)	ปลากะพงผัดฉ่า (0.74)	ปลากะพงสามรส (0.73)
ข้าวราดกะเพราหมูชาบู	ข้าวราดกะเพราหมู (0.96)	ข้าวราดกะเพราหมูกรอบ (0.84)	ข้าวราดกะเพราไก่ (0.82)	ข้าวราดกะเพราปลาหมึก (0.80)	ข้าวราดกะเพรากุ้ง (0.80)
กุ้งทอดกระเทียมพริกไทย	ปลาหมึกทอดกระเทียมพริกไทย (0.90)	หมูทอดกระเทียมพริกไทย (0.84)	ปลากะพงทอดกระเทียม (0.83)	ข้าวหน้ากุ้งทอดกระเทียม (0.81)	กุ้งนึ่งกระเทียม (0.79)
ข้าวผัดปู	สลัดปู (0.62)	ข้าวผัดหนำเลี้ยบ (0.62)	ข้าวผัดหมูยอ (0.57)	ข้าวผัดกุนเชียง (0.56)	ข้าวผัดน้ำพริกเผาเนิ้อ (0.55)
ทอดมันปลา	ปลาทูทอด (0.63)	ลาบทอด (0.55)	ผัดไทยเกี๊ยวทอด (0.48)	ปลากะพงทอดกระเทียม (0.48)	แกงส้มปลาช่อน ทอด (0.47)
น้ำสับปะรดปั่น	น้ำแคนตาลูปปั่น (0.93)	น้ำลิ้นจี่ปั่น (0.91)	น้ำแตงโมปั่น (0.90)	น้ำมะนาวปั่น (0.87)	น้ำมะพร้าวปั่น (0.87)
แพนงกุ้ง	แพนงหมู (0.63)	แพนงไก่ (0.60)	แกงป่ากุ้ง (0.49)	ต้มข่ากุ้ง (0.49)	พล่ากุ้ง (0.48)
แกงส้มเนื้อปลากะพงทอด	แกงส้มเนื้อปลากะพง ไม่ทอด (0.93)	เนื้อปลากะพงทอดพริกไทยดำ (0.92)	แกงส้มเนื้อปลากะพง ไข่ชะอม (0.88)	ต้มยำเนื้อปลากะพง (0.87)	ต้มข่าเนื้อปลากะพง (0.87)
เอ็นหมูน้ำแดง	เต้าหู้น้ำแดงเจ (0.15)	ต้มยำเอ็นหมู (0.13)	ยำเอ็นหมู (0.12)	เต้าหู้น้ำแดง (0.02)	กะเพราปลาหมึก (0.00)
ข้าวหน้าไก่ทอดกระเทียม	ข้าวหน้าหมูทอดกระเทียม (0.81)	ข้าวหน้าปลาหมึกทอดกระเทียม (0.80)	ข้าวหน้ากุ้งทอดกระเทียม (0.76)	ข้าวหน้าไก่ (0.64)	ข้าวราดกะเพราปลาหมึก (0.59)
กะเพราไก่	แกงป่าไก่ (0.80)	ต้มข่าไก่ (0.79)	แกงเขียวหวานไก่ (0.78)	มัสมั่นไก่ (0.77)	กต.ผัดแกงเขียวหวานไก่ (0.74)
เมี่ยงเห็ด	ต้มโคล้งเห็ดฟาง (0.72)	ข้าวอบเห็ดหอม (0.65)	ยำเห็ดฟาง (0.62)	ยำเห็ดเข็มทอง (0.37)	เมี่ยงชะพลู (0.37)
โรตีแกงเขียวหวานไก่	กต.ผัดแกงเขียวหวานไก่ (0.91)	แกงเขียวหวานไก่ (0.90)	ผัดไทยไก่ (0.82)	ข้าวผัดเขียวหวานไก่ (0.80)	ข้าวผัดน้ำพริกเผาไก่ (0.79)
ข้าวราดกะเพราไก่	ข้าวราดกะเพราหมู (0.88)	ข้าวราดกะเพราปลาหมึก (0.86)	ข้าวราดกะเพราหมูกรอบ (0.85)	ข้าวราดกะเพรากุ้ง (0.83)	ข้าวราดกะเพราหมูชาบู (0.82)
ต้มยำรวมมิตร	ต้มยำโป๊ะแตก (0.72)	แกงจืดรวมมิตร (0.70)	ผัดผักรวมมิตรหมูกรอบ (0.47)	ไข่ตุ๋นต้มยำทะเลหม้อไฟ (0.46)	ต้มยำไก่ (0.43)
ส้มตำเจ	ห่อหมกเจ (0.85)	แกงเขียวหวานเจ (0.85)	ผัดกะเพราเจ (0.84)	ต้มยำเจ (0.81)	ขนมผักกาดเจ (0.80)
ก๋วยเตี๋ยวราดหน้าทะเล	กต.ทะเลน้ำพริกเผา (0.88)	กต.ราดหน้าปลาหมึก (0.71)	ผัดไทยทะเล (0.67)	กต.ราดหน้ากุ้ง (0.63)	กต.ราดหน้าไก่ (0.63)
แพนงเนื้อ	แกงป่าเนื้อ (0.49)	ลาบเนื้อ (0.48)	เนื้อแดดเดียว (0.47)	แพนงหมู (0.45)	แกงเขียวหวานเนื้อ (0.43)
ผัดผักบุ้งไฟแดง	ถั่วฝักยาวผัดพริกขิงหมูกรอบ (0.72)	ผัดผักกะเฉดไฟแดง (0.70)	กะหล่ำปลีผัดน้ำปลา (0.68)	ผัดผักรวมมิตร (0.64)	ผัดผักรวมมิตรหมูกรอบ (0.63)
น้ำอัญชัญมะนาว	น้ำอัญชัญมะนาวโซดา (0.93)	น้ำอัญชัญ (0.86)	น้ำมะนาว (0.77)	น้ำมะนาวโซดา (0.69)	น้ำเขียวมะนาวโซดา (0.69)
ก๋วยเตี๋ยวราดหน้าไก่	กต.ผัดขี้เมาไก่ (0.93)	กต.ราดหน้าปลาหมึก (0.80)	กต.ราดหน้าหมูนุ่ม (0.76)	กต.ราดหน้ากุ้ง (0.76)	ผัดไทยไก่ (0.75)
ก๋วยเตี๋ยวทะเลน้ำพริกเผา	กต.ราดหน้าทะเล (0.88)	ผัดไทยทะเล (0.76)	ไข่ตุ๋นต้มยำทะเลหม้อไฟ (0.70)	ข้าวผัดทะเล (0.65)	ห่อหมกทะเล (0.62)
น้ำขิงร้อน	น้ำมะตูมร้อน (0.91)	น้ำขิง (0.83)	น้ำมะตูม (0.68)	น้ำมะนาว (0.67)	น้ำกระเจี๊ยบ (0.67)
สลัดไข่	ข้าวผัดไข่ (0.60)	ไข่พะโล้ (0.57)	สลัดไก่ (0.55)	ผัดไทยห่อไข่ (0.53)	สลัดผักสด (0.53)
สาคูแคนตาลูป	ข้าวอบสัปปะรด (0.45)	ข้าวอบสับปะรด (0.37)	มะยงชิดลอยแก้ว (0.37)	เฉาก๊วย ลูกชิด ขนุน (0.32)	ลิ้นจี่ลอยแก้ว (0.30)
ต้มข่าเห็ดเจ	ผัดกะเพราเห็ดเจ (0.97)	ต้มยำเห็ดเจ (0.91)	ยำเห็ดฟางเจ (0.80)	เต้าหู้ผัดกะเพราเจ (0.71)	เห็ดสี่สหายเจ (0.69)
น้ำปลาเห็ดฟาง	น้ำมะตูม (0.75)	น้ำขิง (0.72)	น้ำกระเจี๊ยบ (0.72)	น้ำมะพร้าว (0.68)	เต้าหู้น้ำแดง (0.64)
เส้นหมี่ผัดกะเฉดเจ	เส้นหมี่ผัดกะเฉด (0.77)	ผัดขนมผักกาดเจ (0.75)	ผัดผักบุ้ง เจ (0.75)	ผัดวุ้นเส้นดอกไม้จีนเจ (0.74)	เต้าหู้ผัดถั่วงอกเจ (0.73)
ลาบหมู	ลาบวุ้นเส้นหมู (0.90)	แกงป่าหมู (0.88)	แกงเขียวหวานหมู (0.84)	หมูสะเต๊ะ (0.83)	หมูแดดเดียว (0.83)
ชาไทย	เฉาก๊วย ชาไทย (0.88)	ไอศครีมชาไทย (0.78)	ชาจีน (0.62)	ส้มตำไทย (0.24)	ชามะนาว (0.06)
แกงจืดเต้าหู้วุ้นเส้นหมูสับ	แกงจืดเต้าหู้ หมูสับ สาหร่าย (0.84)	แกงจืดหมูสับสาหร่าย (0.76)	แกงจืดไข่น้ำ (0.66)	แกงจืดผักกาดขาวหมูสับ (0.65)	ข้าวต้มหมูสับ (0.64)
ข้าวราดกะเพราเนื้อชัคโรล	ข้าวราดไข่เจียวเนื้อปู (0.77)	ข้าวราดกะเพราเนื้อปลากะพง (0.74)	ข้าวราดกะเพราปลาหมึก (0.69)	ข้าวราดกะเพราหมูกรอบ (0.69)	ข้าวราดกะเพราหมู (0.66)
แกงเขียวหวานเนื้อ	แกงป่าเนื้อ (0.93)	โรตีแกงเขียวหวานเนื้อ (0.90)	แกงเขียวหวานเนื้อพริกขี้หนู (0.88)	เนื้อแดดเดียว (0.88)	ลาบเนื้อ (0.84)
แพนงไก่	แพนงหมู (0.73)	แพนงกุ้ง (0.60)	แพนงเนื้อ (0.42)	ลาบไก่ (0.37)	แกงป่าไก่ (0.36)
สลัดปู	ข้าวผัดปู (0.62)	ไข่เจียวเนื้อปู (0.44)	สลัดทูน่า (0.39)	สลัดกุ้งวาซาบิ (0.37)	ข้าวราดไข่เจียวเนื้อปู (0.35)
ส้มตำคอหมูย่าง	คอหมูย่าง (0.91)	ยำคอหมูย่าง (0.89)	ลาบหมู (0.70)	หมูสะเต๊ะ (0.68)	แกงป่าหมู (0.68)
เนื้อปูผัดพริกไทยดำ	ปูนิ่มผัดพริกไทยดำ (0.88)	เนื้อปูผัดผงกะหรี่ (0.86)	ข้าวผัดพริกสดเนื้อ (0.74)	เนื้อปลากะพงทอดพริกไทยดำ (0.72)	หมูกรอบผัดพริกเกลือ (0.70)
ข้าวราดกะเพราเนื้อปลากะพง	กะเพราเนื้อปลากะพง (0.88)	เนื้อปลากะพงทอดพริกไทยดำ (0.83)	เนื้อปลากะพงมะนาว (0.82)	ต้มข่าเนื้อปลากะพง (0.82)	เนื้อปลากะพงนึ่งมะนาว (0.81)
น้ำเก็กฮวยรสน้ำผึ้ง	น้ำมะนาว (0.69)	น้ำขิง (0.69)	น้ำมะตูม (0.66)	น้ำกระเจี๊ยบ (0.64)	น้ำมะนาวโซดา (0.63)
พล่ากุ้งใหญ่	พล่ากุ้ง (0.80)	ต้มข่ากุ้ง (0.71)	แกงป่ากุ้ง (0.71)	ทอดมันกุ้ง (0.67)	แกงเขียวหวานกุ้ง (0.64)
หมูทอดกระเทียมพริกไทย	ปลาหมึกทอดกระเทียมพริกไทย (0.86)	กุ้งทอดกระเทียมพริกไทย (0.84)	ข้าวหน้าหมูทอดกระเทียม (0.80)	ไก่ทอดกระเทียมพริกไทย (0.73)	ปลากะพงทอดกระเทียม (0.71)
น้ำมะนาวโซดา	น้ำเขียวมะนาวโซดา (0.92)	น้ำมะนาว (0.90)	น้ำแดงมะนาวโซดา (0.89)	น้ำอัญชัญมะนาวโซดา (0.83)	น้ำมะนาวปั่น (0.75)
ข้าวราดกะเพราปลาหมึก	ข้าวราดกะเพรากุ้ง (0.90)	ข้าวราดกะเพราหมูกรอบ (0.90)	ข้าวราดกะเพราไก่ (0.86)	ข้าวราดกะเพราหมู (0.85)	ข้าวราดกะเพราหมูชาบู (0.80)
กุ้งส่วนกะทะร้อน	กุ้งส่วน (0.64)	หอยแมลงภู่นิวซีแลนด์ส่วนกะทะร้อน (0.64)	ต้มข่ากุ้ง (0.56)	ข้าวต้มกุ้ง (0.55)	แกงป่ากุ้ง (0.55)
ผัดไทยเกี๊ยวทอด	ปลาช่อนทอดส้มตำ (0.73)	ปลาทูทอด (0.71)	ลาบทอด (0.70)	ข้าวผัดน้ำพริกกะปิปลาทูทอด (0.67)	แกงส้มปลาช่อน ทอด (0.66)
ยำผักบุ้งกรอบเจ	ยำวุ้นเส้นเจ (0.75)	ผัดผักบุ้ง เจ (0.67)	ยำเห็ดฟางเจ (0.63)	ยำผักบุ้งกรอบ (0.62)	ผัดวุ้นเส้นดอกไม้จีนเจ (0.62)
กาแฟร้อน	กาแฟเย็น (0.58)	ลาเต้ (0.13)	น้ำส้มคั้น (0.10)	โอวัลตินเย็น (0.09)	โกโก้เย็น (0.05)
เฉาก๊วยชาไทย	ชาไทย (0.88)	ไอศครีมชาไทย (0.85)	ชาจีน (0.60)	ส้มตำไทย (0.25)	ชามะนาว (0.20)
ลาบวุ้นเส้นหมู	ลาบหมู (0.90)	แกงป่าหมู (0.81)	แกงเขียวหวานหมู (0.80)	ลาบวุ้นเส้นไก่ (0.79)	ผัดไทยหมู (0.79)
ก๋วยเตี๋ยวราดหน้ากุ้ง	กต.ผัดขี้เมากุ้ง (0.93)	กต.ราดหน้าปลาหมึก (0.85)	กต.ราดหน้าปลากะพง (0.82)	กต.ราดหน้าไก่ (0.76)	ข้าวต้มกุ้ง (0.76)
น้ำทะเล	ห่อหมกทะเล (0.14)	น้ำมะพร้าว (0.03)	น้ำมะตูม (0.03)	ผัดไทยทะเล (0.01)	น้ำกระเจี๊ยบ (0.00)
ข้าวผัดไข่	ไข่พะโล้ (0.69)	ข้าวผัดหนำเลี้ยบ (0.68)	ข้าวผัดกุนเชียง (0.68)	ข้าวผัดหมูยอ (0.67)	ข้าวผัดน้ำพริกเผาปลาหมึก (0.66)
หอยแมลงภู่นิวซีแลนด์ผัดผงกะหรี่	กุ้งผัดผงกะหรี่ (0.81)	เนื้อออสเตรเลียผัดน้ำมันหอย (0.70)	เนื้อปูผัดผงกะหรี่ (0.70)	ปลาหมึกผัดไข่เค็ม (0.66)	ปลาหมึกผัดผงกระหรี่ (0.65)
กุ้งผัดเม็ดมะม่วงหิมพานต์	กุ้งผัดหน่อไม้ฝรั่ง (0.86)	กุ้งผัดผงกะหรี่ (0.83)	ไก่ผัดเม็ดมะม่วงหิมพานต์ (0.83)	กุ้งผัดหนำเลี๊ยบ (0.80)	ผัดผักรวมมิตรกุ้ง (0.79)
ก๋วยเตี๋ยวผัดซีอิ๊วเจ	ข้าวผัดซีอิ้วเจ (0.84)	เต้าหู้ผัดกะเพราเจ (0.76)	ข้าวผัดเจ (0.74)	แกงเขียวหวานเจ (0.74)	ต้มยำเจ (0.73)
กุ้งนึ่งกระเทียม	กุ้งทอดกระเทียมพริกไทย (0.79)	ปลาหมึกนึ่งมะนาว (0.72)	ปลากะพงนึ่งมะนาว (0.70)	ปลาช่อนนึ่งมะนาว (0.69)	ข้าวหน้ากุ้งทอดกระเทียม (0.67)
ข้าวผัดไก่	ข้าวผัดเขียวหวานไก่ (0.98)	ข้าวผัดน้ำพริกเผาไก่ (0.95)	ข้าวผัดซีอิ๊วไก่ (0.87)	กต.ผัดแกงเขียวหวานไก่ (0.83)	แกงเขียวหวานไก่ (0.82)
ต้มข่ากุ้ง	แกงป่ากุ้ง (0.96)	แกงเขียวหวานกุ้ง (0.93)	ทอดมันกุ้ง (0.92)	กต.ผัดแกงเขียวหวานกุ้ง (0.89)	พล่ากุ้ง (0.88)
ผัดผักรวมมิตรกุ้ง	กุ้งผัดหน่อไม้ฝรั่ง (0.89)	ผัดผักรวมมิตร (0.88)	ผัดผักรวมมิตรหมูกรอบ (0.86)	ผัดผักรวมมิตรหมู (0.85)	กุ้งผัดหนำเลี๊ยบ (0.83)
ผักกาดขาวน้ำมันหอย	คะน้าฮ่องกงน้ำมันหอย (0.67)	ผัดเห็ดเข็มทองน้ำมันหอย (0.62)	ข้าวราดหน้าเนื้อน้ำมันหอย (0.61)	หมูน้ำมันหอย (0.61)	เนื้อออสเตรเลียผัดน้ำมันหอย (0.57)
กะเพราเนื้อ	แกงป่าเนื้อ (0.84)	แกงเขียวหวานเนื้อ (0.82)	แกงเขียวหวานเนื้อพริกขี้หนู (0.79)	เนื้อแดดเดียว (0.79)	ลาบเนื้อ (0.74)
น้ำพริกกะปิ	น้ำพริกกะปิปลาทูทอด (0.72)	ข้าวผัดน้ำพริกกะปิปลาทูทอด (0.66)	ข้าวผัดน้ำพริกลงเรือ (0.49)	น้ำพริกลงเรือ (0.43)	ข้าวผัดน้ำพริกหนุ่ม (0.40)
น้ำพริกลงเรือ	ข้าวผัดน้ำพริกลงเรือ (0.79)	น้ำพริกกะปิ (0.43)	น้ำพริกกะปิปลาทูทอด (0.35)	ข้าวผัดน้ำพริกกะปิปลาทูทอด (0.33)	ข้าวผัดน้ำพริกหนุ่ม (0.29)
เนื้อปลากะพงนึ่งมะนาว	เนื้อปลากะพงมะนาว (0.92)	ปลากะพงนึ่งมะนาว (0.87)	กะเพราเนื้อปลากะพง (0.86)	เนื้อปลากะพงสามรส (0.85)	ต้มข่าเนื้อปลากะพง (0.85)
โรตีแกงเขียวหวานเนื้อ	แกงเขียวหวานเนื้อ (0.90)	ข้าวผัดเขียวหวานเนื้อ (0.82)	แกงเขียวหวานเนื้อพริกขี้หนู (0.81)	แกงป่าเนื้อ (0.79)	ลาบเนื้อ (0.76)
หมูแดดเดียว	แกงป่าหมู (0.92)	หมูสะเต๊ะ (0.89)	แกงเขียวหวานหมู (0.87)	ผัดไทยหมู (0.83)	ลาบหมู (0.83)
กุ้งอบเกลือ	กุ้งอบวุ้นเส้น (0.78)	ต้มข่ากุ้ง (0.63)	แกงป่ากุ้ง (0.62)	ทอดมันกุ้ง (0.61)	แกงเขียวหวานกุ้ง (0.60)
ผัดไทยทะเล	ห่อหมกทะเล (0.81)	กต.ทะเลน้ำพริกเผา (0.76)	ข้าวผัดทะเล (0.75)	แกงส้มทะเล (0.71)	กะเพราทะเล (0.69)
ผัดกะเพราเจ	ขนมผักกาดเจ (0.93)	แกงเขียวหวานเจ (0.91)	ห่อหมกเจ (0.91)	ต้มยำเจ (0.85)	ข้าวผัดเจ (0.84)
ผัดมะกะโรนีกุ้ง	กุ้งผัดหน่อไม้ฝรั่ง (0.86)	ผัดมะกะโรนีขี้เมากะเพรากรอบกุ้ง (0.84)	กุ้งผัดหนำเลี๊ยบ (0.82)	ผัดผักรวมมิตรกุ้ง (0.78)	ผัดมะกะโรนีหมู (0.75)
กุ้งอบวุ้นเส้น	ลาบวุ้นเส้นกุ้ง (0.79)	กุ้งอบเกลือ (0.78)	ทอดมันกุ้ง (0.72)	ต้มข่ากุ้ง (0.71)	แกงเขียวหวานกุ้ง (0.71)
ยำเนื้อออสเตรเลียย่าง	แกงเขียวหวานเนื้อ (0.65)	ข้าวผัดเขียวหวานเนื้อ (0.65)	ลาบเนื้อ (0.64)	แกงป่าเนื้อ (0.63)	โรตีแกงเขียวหวานเนื้อ (0.62)
ข้าวหน้ากุ้งทอดกระเทียม	ข้าวหน้าปลาหมึกทอดกระเทียม (0.93)	ข้าวหน้าหมูทอดกระเทียม (0.88)	กุ้งทอดกระเทียมพริกไทย (0.81)	ข้าวหน้าไก่ทอดกระเทียม (0.76)	ข้าวราดกะเพรากุ้ง (0.76)
แกงเขียวหวานหมูพริกขี้หนู	แกงเขียวหวานหมู (0.89)	กต.ผัดแกงเขียวหวานหมู (0.87)	แกงป่าหมู (0.83)	ข้าวผัดน้ำพริกเผาหมู (0.81)	โรตีแกงเขียวหวานหมู (0.81)
สุกี้ยากี้สูตรโบราณหมู	สุกี้ยากี้สูตรโบราณไก่ (0.79)	สุกี้ยากี้สูตรโบราณกุ้ง (0.71)	กต.ผัดแกงเขียวหวานหมู (0.60)	หมูสะเต๊ะ (0.60)	แกงเขียวหวานหมู (0.59)
ทอดมันข้าวโพดเจ	แกงเขียวหวานเจ (0.76)	ผัดกะเพราเจ (0.76)	เต้าหู้ผัดกะเพราเจ (0.76)	ห่อหมกเจ (0.75)	ข้าวผัดเจ (0.72)
ข้าวผัดพริกสดกุ้ง	ข้าวผัดพริกสดปลาหมึก (0.89)	แกงเลียงกุ้งสด (0.83)	ข้าวผัดพริกสดหมู (0.83)	ผัดไทยกุ้งสด (0.83)	ข้าวผัดพริกสดไก่ (0.83)
ข้าวผัดหนำเลี้ยบ	ข้าวผัดกุนเชียง (0.92)	ข้าวผัดหมูยอ (0.90)	ข้าวผัดน้ำพริกเผาเนิ้อ (0.88)	ข้าวผัดน้ำพริกเผาปลาหมึก (0.78)	ข้าวผัดปลาหมึก (0.78)
