label	1st	2nd	3rd	4th	5th
กุ้งส่วน	กุ้งกระเบื้อง (0.89)	ผัดไทยกุ้งสด (0.65)	ซี่โครงขลุกขลิก (0.63)	กต.ผัดซีอิ๊วเจ (0.63)	ปอเปี๊ยะบานาน่าลีฟ (0.63)
น้ำส้มคั้น	น้ำมะพร้าว (0.84)	สปาเก็ตตี้กุ้ง (0.80)	แกงส้มกุ้ง (0.79)	ข้าวผัดซีอิ๊วกุ้ง (0.78)	น้ำเขียวมะนาวโซดา (0.69)
กต.ราดหน้าปลากะพง	ข้าวราดหน้าเนื้อน้ำมันหอย (0.93)	กต.ผัดไทยเจ (0.92)	เห็ดสี่สหายเจ (0.90)	เนื้อออสเตรเลียผัดน้ำมันหอย (0.89)	กต.ผัดซีอิ๊วทะเล (0.88)
ข้าวราดกะเพราหมูชาบู	ข้าวราดกะเพราไก่ (1.00)	ผัดผักกะเฉด (0.99)	เนื้อปลากะพงนึ่งมะนาว (0.99)	ส้มตำเคลกรอบ (0.99)	ผัดมะกะโรนีไก่ (0.99)
กุ้งทอดกระเทียมพริกไทย	ปูนิ่มผัดพริกไทยดำ (0.99)	ไก่ทอดกระเทียมพริกไทย (0.99)	ผัดผักรวมมิตร (0.98)	ลาบวุ้นเส้นกุ้ง (0.98)	ผัดกะเพราเห็ดเจ (0.98)
ข้าวผัดปู	ต้มข่าเห็ดเจ (0.98)	สลัดกุ้งวาซาบิ (0.98)	หอยแมลงภู่นิวซีแลนด์อบหม้อดิน (0.96)	แกงเขียวหวานลูกชิ้นปลากราย (0.94)	เนื้อน้ำตก (0.93)
ทอดมันปลา	ข้าวผัดมันกุ้ง (0.83)	ขนมจีบปลากราย (0.81)	แพนงกุ้ง (0.80)	น้ำอัญชัญ (0.79)	ข้าวผัดอเมริกัน (0.76)
น้ำสับปะรดปั่น	น้ำมะพร้าวปั่น (0.99)	ข้าวผัดน้ำพริกเผาไก่ (0.99)	ข้าวราดกะเพรากุ้ง (0.98)	กุ้งแช่น้ำปลา (0.98)	กต.ผัดขี้เมากุ้ง (0.97)
แพนงกุ้ง	แพนงหมู (0.86)	ขนมจีบปลากราย (0.85)	น้ำอัญชัญ (0.83)	ทอดมันปลา (0.80)	ข้าวผัดอเมริกัน (0.80)
แกงส้มเนื้อปลากะพง ทอด	แกงส้มเนื้อปลากะพง ไข่ชะอม (1.00)	แกงส้มเนื้อปลากะพง ไม่ทอด (1.00)	ยำผักบุ้งกรอบเจ (0.99)	ผัดไทยทะเล (0.99)	ขาหมูทอดส้มตำ (0.99)
เอ็นหมูน้ำแดง	ข้าวผัดเขียวหวานหมู (0.99)	ข้าวผัดเขียวหวานไก่ (0.98)	ปลาหมึกนึ่งมะนาว (0.98)	ข้าวราดไข่เจียว (0.98)	หมี่ซั่วเจ (0.96)
ข้าวหน้าไก่ทอดกระเทียม	ลาบทอด (0.99)	ข้าวผัดน้ำพริกเผาเนื้อปลากระพง (0.98)	ข้าวต้มเนื้อปลากระพง (0.98)	แกงเผ็ดยอดมะพร้าวไก่ (0.98)	ข้าวหมูกรอบคั่วพริกเกลือ ไข่เป็ดดาว (0.98)
กะเพราไก่	แพนงเนื้อ (1.00)	ปลาช่อนแป๊ะซะ (1.00)	หมูสะเต๊ะ (1.00)	หมูน้ำตก (1.00)	ผัดผักบุ้ง เจ (1.00)
เมี่ยงเห็ด	น้ำอัญชัญ (0.70)	น้ำแก้วมังกรปั่น (0.70)	ข้าวผัดซีอิ๊วกุ้ง (0.68)	มะพร้าวอ่อนหวานเย็น (0.68)	แพนงกุ้ง (0.65)
โรตีแกงเขียวหวานไก่	แกงจืดหมูสับสาหร่าย (0.99)	เต้าหู้ผัดพริกกระเทียม (0.98)	ปลากะพงสามรส (0.98)	ปลาหมึกทอดกระเทียมพริกไทย (0.98)	ข้าวราดไข่เจียวเนื้อปู (0.98)
ข้าวราดกะเพราไก่	ข้าวราดกะเพราหมูชาบู (1.00)	ส้มตำเคลกรอบ (0.99)	เนื้อปลากะพงนึ่งมะนาว (0.99)	ผัดผักกะเฉด (0.99)	ข้าวราดกะเพราทะเล (0.99)
ต้มยำรวมมิตร	สุกี้ยากี้สูตรโบราณกุ้ง (0.98)	ห่อหมกเจ (0.96)	แกงส้มชะอมไข่ (0.95)	ปลากะพงนึ่งบ๊วย (0.95)	สลัดผักสด (0.95)
ส้มตำเจ	ข้าวหน้าปลาหมึกทอดกระเทียม (0.99)	ยำชะพลูกรอบ (0.96)	ต้มยำเนื้อปลากะพง (0.95)	กะหล่ำปลีผัดน้ำปลา (0.95)	น้ำส้มปั่น (0.95)
กต.ราดหน้าทะเล	ข้าวผัดมันกุ้ง (0.71)	กต.ราดหน้าปลาหมึก (0.71)	หมูแดดเดียว (0.69)	ต้มยำกุ้ง (0.68)	กต.ราดหน้ากุ้ง (0.68)
แพนงเนื้อ	กะเพราไก่ (1.00)	ปลาช่อนแป๊ะซะ (1.00)	หมูสะเต๊ะ (1.00)	หมูน้ำตก (1.00)	ผัดผักบุ้ง เจ (1.00)
ผัดผักบุ้งไฟแดง	ทอดมันกุ้ง (0.72)	ข้าวผัดมันกุ้ง (0.72)	แพนงกุ้ง (0.70)	หมูแดดเดียว (0.68)	ผัดไทยไก่ (0.68)
น้ำอัญชัญมะนาว	น้ำแดงมะนาวโซดา (1.00)	ข้าวผัดเขียวหวานกุ้ง (1.00)	ปลาช่อนแป๊ะซะ (1.00)	กะเพราไก่ (1.00)	ผัดผักบุ้ง เจ (1.00)
กต.ราดหน้าไก่	กต.ราดหน้ากุ้ง (0.90)	ข้าวผัดไก่ (0.70)	กต.ราดหน้าทะเล (0.66)	หมูแดดเดียว (0.61)	ส้มตำไทย (0.61)
กต.ทะเลน้ำพริกเผา	น้ำพริกลงเรือ (1.00)	ข้าวราดกะเพราหมู (0.99)	มะม่วงมะพร้าวปั่น (0.99)	แกงป่ากุ้ง (0.99)	น้ำมะตูม (0.99)
น้ำขิงร้อน	น้ำมะนาวปั่น (0.98)	ต้มยำโป๊ะแตก (0.96)	ผัดผักกะเฉดไฟแดง (0.95)	ผัดมะกะโรนีกุ้ง (0.94)	แปะก๋วยซอง (0.94)
สลัดไข่	ส้มตำไข่เค็ม (0.94)	ยำวุ้นเส้นพม่า (0.93)	ยำคอหมูย่าง (0.91)	ข้าวผัดพริกสดไก่ (0.89)	ส้มตำคอหมูย่าง (0.86)
สาคูแคนตาลูป	ชาไทย (0.95)	ข้าวผัดน้ำพริกเผากุ้ง (0.93)	ข้าวผัดน้ำพริกเผาหมู (0.93)	กต.ผัดซีอิ๊วเนื้อ (0.92)	แพนงไก่ (0.92)
ต้มข่าเห็ดเจ	สลัดกุ้งวาซาบิ (0.98)	หอยแมลงภู่นิวซีแลนด์อบหม้อดิน (0.98)	ข้าวผัดปู (0.98)	แกงเขียวหวานลูกชิ้นปลากราย (0.96)	เนื้อน้ำตก (0.93)
น้ำปลาเห็ดฟาง	ลาบวุ้นเส้นกุ้ง (0.98)	ทะเลรวมผัดฉ่า (0.98)	กุ้งทอดกระเทียมพริกไทย (0.98)	ไก่ทอดกระเทียมพริกไทย (0.97)	หมูทอดกระเทียมพริกไทย (0.97)
เส้นหมี่ผัดกะเฉดเจ	ผัดกะเพราเห็ดเจ (0.98)	ปูนิ่มผัดผงกระหรี่ (0.98)	เส้นหมี่ผัดกะเฉดทะเล (0.98)	ผัดกะเพราเจ (0.98)	เส้นหมี่ผัดกะเฉดหมู (0.98)
ลาบหมู	ข้าวผัดซีอิ๊วปลาหมึก (0.96)	น้ำพริกกะปิ (0.94)	ข้าวผัดผงกระหรี่กุ้ง (0.93)	ข้าวผัดผงกระหรี่หมู (0.93)	ข้าวราดกะเพราปลาหมึก (0.92)
ชาไทย	สาคูแคนตาลูป (0.95)	แพนงไก่ (0.95)	ผัดไทยห่อไข่ (0.95)	ข้าวผัดน้ำพริกเผาไก่ (0.95)	กาแฟร้อน (0.94)
แกงจืดเต้าหู้ วุ้นเส้น หมูสับ	แกงจืดเต้าหู้ หมูสับ สาหร่าย (1.00)	ยำหอยนางรม (1.00)	ปลาดุกฟูขี้เมากะเพรากรอบ (1.00)	Evian (1.00)	ซี่โครงหมูทอดกระเทียมพริกไทย (1.00)
ข้าวราดกะเพราเนื้อชัคโรล	ต้มโคล้งปลาดุกฟู (0.92)	เนื้อปูผัดผงกะหรี่ (0.91)	กุ้งผัดผงกะหรี่ (0.91)	หมูกรอบผัดพริกเกลือ (0.91)	ข้าวราดกะเพราปลาหมึก (0.90)
แกงเขียวหวานเนื้อ	แกงเขียวหวานไก่ (0.98)	เต้าหู้น้ำแดง (0.98)	ข้าวผัดเขียวหวานเนื้อ (0.98)	แกงเขียวหวานหมู (0.98)	เฉาก๊วย ลูกชิด ขนุน (0.97)
แพนงไก่	กุ้งแช่น้ำปลา (0.96)	ชามะนาว (0.95)	ชาไทย (0.95)	ข้าวผัดน้ำพริกเผาไก่ (0.95)	ผัดไทยห่อไข่ (0.95)
สลัดปู	ข้าวผัดหมู (0.77)	ข้าวต้มกุ้ง (0.77)	ข้าวผัดอเมริกัน (0.73)	ข้าวผัดเจ (0.72)	น้ำมะนาว (0.72)
ส้มตำคอหมูย่าง	ข้าวผัดพริกสดไก่ (0.96)	สุกี้ยากี้สูตรโบราณทะเล (0.96)	ส้มตำกุ้งสด (0.89)	ส้มตำไข่เค็ม (0.88)	ยำวุ้นเส้นพม่า (0.88)
เนื้อปูผัดพริกไทยดำ	กต.ผัดขี้เมากุ้ง (0.97)	ต้มยำเห็ดใส่ยอดมะพร้าวเจ (0.97)	หอยแมลงภู่นิวซีแลนด์ส่วนกะทะร้อน (0.96)	ผัดเห็ดรวมเจ (0.96)	น้ำสับปะรดปั่น (0.96)
ข้าวราดกะเพราเนื้อปลากะพง	ลาบวุ้นเส้นกุ้ง (0.96)	ลาบวุ้นเส้นหมู (0.96)	ข้าวผัดน้ำพริกกะปิปลาทูทอด (0.96)	ผัดผักรวมมิตรหมูกรอบ (0.96)	ข้าวผัดผงกระหรี่หมู (0.96)
น้ำเก็กฮวยรสน้ำผึ้ง	ไอศครีมชาไทย (0.80)	ผักกาดขาวน้ำมันหอย (0.78)	ขนมจีบปลากราย (0.73)	ยำถั่วพลู (0.71)	ข้าวผัดซีอิ๊วไก่ (0.70)
พล่ากุ้งใหญ่	น้ำอัญชัญ (0.29)	หมี่ซั่วเจ (0.29)	เมี่ยงเห็ด (0.29)	กุ้งส่วน (0.29)	ไข่เจียวหอยนางรม (0.28)
หมูทอดกระเทียมพริกไทย	ผัดขนมผักกาดเจ (0.99)	ผัดผักรวมมิตรหมูกรอบ (0.99)	ผัดผักรวมมิตร (0.99)	ปูนิ่มผัดผงกระหรี่ (0.99)	ปูนิ่มทอดกระเทียม (0.99)
น้ำมะนาวโซดา	พล่ากุ้ง (0.76)	ข้าวผัดซีอิ๊วกุ้ง (0.73)	น้ำเขียวมะนาวโซดา (0.72)	กุ้งผัดหน่อไม้ฝรั่ง (0.67)	น้ำส้มคั้น (0.66)
ข้าวราดกะเพราปลาหมึก	ข้าวผัดซีอิ๊วปลาหมึก (0.95)	กะเพราหมู (0.94)	กต.ผัดแกงเขียวหวานไก่ (0.94)	ลาบหมู (0.92)	ข้าวผัดผงกระหรี่กุ้ง (0.91)
กุ้งส่วนกะทะร้อน	กต.ต้มยำกุ้งน้ำข้น (0.96)	กต.ราดหน้าเจ (0.93)	ไข่เจียวเนื้อปู (0.89)	คะน้าหมูกรอบ (0.89)	เผือกทอดเจ (0.88)
ผัดไทยเกี๊ยวทอด	ข้าวผัดพริกสดหมู (0.99)	สุกี้ยากี้สูตรโบราณไก่ (0.97)	สุกี้ยากี้สูตรโบราณหมู (0.96)	แกงส้มปลากะพง ตัว (0.96)	แกงส้มเนื้อปลากะพง ไข่ชะอม (0.95)
ยำผักบุ้งกรอบเจ	แกงส้มเนื้อปลากะพง ไข่ชะอม (1.00)	ขาหมูทอดส้มตำ (0.99)	แกงส้มเนื้อปลากะพง ไม่ทอด (0.99)	แกงส้มเนื้อปลากะพง ทอด (0.99)	ผัดไทยทะเล (0.99)
กาแฟร้อน	น้ำมะพร้าวปั่น (0.97)	ข้าวผัดน้ำพริกเผาไก่ (0.97)	น้ำสับปะรดปั่น (0.96)	กุ้งแช่น้ำปลา (0.96)	ผัดไทยห่อไข่ (0.96)
เฉาก๊วย ชาไทย	ผัดมะกะโรนีไก่ (1.00)	ผัดมะกะโรนีหมู (1.00)	เนื้อปลากะพงนึ่งมะนาว (1.00)	ผัดผักกะเฉด (1.00)	ผัดมะกะโรนีกุ้ง (1.00)
ลาบวุ้นเส้นหมู	ลาบวุ้นเส้นกุ้ง (0.99)	เส้นหมี่ผัดกะเฉดทะเล (0.99)	ผัดผักรวมมิตรหมูกรอบ (0.99)	ผัดผักรวมมิตร (0.99)	ผัดกะเพราเห็ดเจ (0.98)
กต.ราดหน้ากุ้ง	กต.ราดหน้าไก่ (0.90)	กต.ราดหน้าทะเล (0.68)	ข้าวผัดไก่ (0.67)	ส้มตำไทย (0.62)	เนื้อแดดเดียว (0.61)
น้ำทะเล	แกงเขียวหวานเจ (1.00)	ต้มยำเห็ดเจ (1.00)	ต้มข่าไก่ (1.00)	ปลากะพงนึ่งมะนาว (0.99)	ข้าวต้มหมูสับ (0.99)
ข้าวผัดไข่	ยำมะม่วง (0.80)	ทอดมันกุ้ง (0.72)	ยำกุนเชียง (0.71)	ข้าวผัดซีอิ๊วไก่ (0.67)	หมูสะเด็ด (0.66)
หอยแมลงภู่นิวซีแลนด์ผัดผงกะหรี่	ถั่วฝักยาวผัดพริกขิงหมูกรอบ (0.94)	เต้าหู้ผัดกะเพราเจ (0.94)	ปลากะพงสามรส (0.93)	เต้าหู้ผัดพริกกระเทียม (0.91)	โรตีแกงเขียวหวานไก่ (0.91)
กุ้งผัดเม็ดมะม่วงหิมพานต์	ข้าวผัดซีอิ๊วหมู (1.00)	ออส่วนกระทะร้อน (1.00)	พล่าปลาช่อน (1.00)	ปลากะพงมหัสจรรย์ (1.00)	ข้าวผัดเขียวหวานกุ้ง (1.00)
กต.ผัดซีอิ๊วเจ	ผัดไทยกุ้งสด (0.94)	ปอเปี๊ยะบานาน่าลีฟ (0.92)	ซี่โครงขลุกขลิก (0.92)	กต.ทรงเครื่อง (0.91)	ปลาดอรี่ขี้เมากะเพรากรอบ (0.91)
กุ้งนึ่งกระเทียม	ข้าวผัดพริกสดปลาหมึก (0.99)	ต้มแซ่บกระดูกหมู (0.99)	เต้าหู้ทอดเจ (0.99)	ผัดไทยทะเล (0.98)	ถั่วแขกผัดกาน่าฉ่ายเจ (0.98)
ข้าวผัดไก่	ส้มตำไทย (0.73)	ข้าวผัดกุ้ง (0.72)	ไก่มะนาว (0.70)	กต.ราดหน้าไก่ (0.70)	กต.ราดหน้ากุ้ง (0.67)
ต้มข่ากุ้ง	พล่ากุ้ง (0.67)	กุ้งผัดหน่อไม้ฝรั่ง (0.67)	น้ำมะนาวโซดา (0.65)	ข้าวผัดซีอิ๊วกุ้ง (0.60)	น้ำเขียวมะนาวโซดา (0.58)
ผัดผักรวมมิตรกุ้ง	ผัดผักรวมมิตรหมู (1.00)	สปาเก็ตตี้ขี้เมาหมู (0.99)	ข้าวผัดน้ำพริกกะปิปลาทูทอด (0.99)	น้ำพริกกะปิปลาทูทอด (0.98)	ข้าวผัดผงกระหรี่หมู (0.98)
ผักกาดขาวน้ำมันหอย	น้ำเก็กฮวยรสน้ำผึ้ง (0.78)	ยำถั่วพลู (0.77)	ข้าวผัดซีอิ๊วไก่ (0.73)	ไอศครีมชาไทย (0.73)	กุ้งผัดหน่อไม้ฝรั่ง (0.72)
กะเพราเนื้อ	ไข่เจียวหอยนางรม (1.00)	ปลาหมึกทอดกระเทียมพริกไทย (0.99)	ข้าวราดไข่เจียวเนื้อปู (0.99)	ข้าวหน้ากุ้งทอดกระเทียม (0.99)	โรตีแกงเขียวหวานเนื้อ (0.98)
น้ำพริกกะปิ	ข้าวผัดผงกระหรี่กุ้ง (0.95)	ข้าวผัดซีอิ๊วปลาหมึก (0.95)	ปลาหมึกผัดกระเทียม (0.95)	น้ำพริกกะปิปลาทูทอด (0.94)	ข้าวผัดผงกระหรี่หมู (0.94)
น้ำพริกลงเรือ	กต.ทะเลน้ำพริกเผา (1.00)	มะม่วงมะพร้าวปั่น (0.99)	ข้าวราดกะเพราหมู (0.99)	น้ำมะตูม (0.99)	แกงป่ากุ้ง (0.99)
เนื้อปลากะพงนึ่งมะนาว	ผัดมะกะโรนีหมู (1.00)	ผัดมะกะโรนีไก่ (1.00)	ผัดผักกะเฉด (1.00)	ผัดมะกะโรนีกุ้ง (1.00)	เต้าหู้ผัดถั่วงอกเจ (1.00)
โรตีแกงเขียวหวานเนื้อ	แกงเผ็ดยอดมะพร้าวหมู (1.00)	ข้าวหน้าหมูทอดกระเทียม (0.99)	ปลาหมึกทอดกระเทียมพริกไทย (0.99)	ซี่โครงหมูทอดกระเทียมพริกไทย (0.99)	แกงเผ็ดยอดมะพร้าวกุ้ง (0.98)
หมูแดดเดียว	เนื้อแดดเดียว (0.69)	กต.ราดหน้าทะเล (0.69)	ข้าวผัดกุ้ง (0.69)	ผัดผักบุ้งไฟแดง (0.68)	ข้าวผัดมันกุ้ง (0.67)
กุ้งอบเกลือ	ปลากะพงมหัสจรรย์ (1.00)	ข้าวอบสับปะรด (1.00)	ไก่ผัดเม็ดมะม่วงหิมพานต์ (1.00)	ข้าวผัดซีอิ๊วหมู (1.00)	ออส่วนกระทะร้อน (1.00)
ผัดไทยทะเล	แกงจืดลูกรอก (1.00)	ขาหมูทอดส้มตำ (1.00)	ต้มแซ่บหมูเด้ง (1.00)	ต้มแซ่บกระดูกหมู (0.99)	ข้าวผัดพริกสดกุ้ง (0.99)
fruitlover	Evian (1.00)	ยำทะเล (1.00)	แกงจืดเต้าหู้ หมูสับ สาหร่าย (1.00)	แกงจืดเต้าหู้ วุ้นเส้น หมูสับ (1.00)	ปลาดุกฟูขี้เมากะเพรากรอบ (1.00)
ผัดกะเพราเจ	เส้นหมี่ผัดกะเฉดทะเล (1.00)	ผัดกะเพราเห็ดเจ (0.98)	ลาบวุ้นเส้นหมู (0.98)	เส้นหมี่ผัดกะเฉดหมู (0.98)	เส้นหมี่ผัดกะเฉดเจ (0.98)
ผัดมะกะโรนีกุ้ง	ผัดมะกะโรนีไก่ (1.00)	แปะก๋วยซอง (1.00)	ข้าวราดกะเพราทะเล (1.00)	เต้าหู้ผัดถั่วงอกเจ (1.00)	ผัดมะกะโรนีหมู (1.00)
กุ้งอบวุ้นเส้น	ผัดไทยกุ้งแม่น้ำ (1.00)	มัสมั่นไก่ (1.00)	ข้าวราดกะเพราทะเล (1.00)	ยำเห็ดเข็มทอง (1.00)	เต้าหู้ผัดถั่วงอกเจ (1.00)
ยำเนื้อออสเตรเลียย่าง	ยำไส้กรอก (0.93)	เต้าหู้ผัดกะเพราเจ (0.90)	กะหล่ำปลีผัดน้ำปลา (0.88)	ถั่วฝักยาวผัดพริกขิงหมูกรอบ (0.86)	กะเพราหมูสับเจ (0.86)
ข้าวหน้ากุ้งทอดกระเทียม	ข้าวราดไข่เจียวเนื้อปู (0.99)	กะเพราเนื้อ (0.99)	ไข่เจียวหอยนางรม (0.99)	ปลาหมึกทอดกระเทียมพริกไทย (0.99)	ไก่ห่อใบเตย (0.98)
แกงเขียวหวานหมูพริกขี้หนู	เผือกทอดเจ (0.98)	ลาบทอดเจ (0.98)	ปลากะพงทอดกระเทียม (0.97)	ไข่เจียวเนื้อปู (0.97)	แกงเผ็ดยอดมะพร้าวเจ (0.95)
สุกี้ยากี้สูตรโบราณหมู	สุกี้ยากี้สูตรโบราณไก่ (0.99)	แกงส้มปลากะพง ตัว (0.99)	แกงส้มเนื้อปลากะพง ไม่ทอด (0.98)	แกงส้มเนื้อปลากะพง ไข่ชะอม (0.98)	ข้าวผัดพริกสดหมู (0.98)
ทอดมันข้าวโพดเจ	ต้มแซ่บหมูนุ่ม (0.96)	เห็ดรวมทอดเจ (0.96)	ข้าวหน้าคอหมูย่าง ไข่ดองซีอิ๊ว (0.93)	ยำเห็ดเข็มทอง (0.93)	แปะก๋วยซอง (0.93)
ข้าวผัดพริกสดกุ้ง	ต้มแซ่บหมูเด้ง (1.00)	ไข่ตุ๋นต้มยำทะเลหม้อไฟ (1.00)	แกงจืดลูกรอก (0.99)	ต้มแซ่บกระดูกหมู (0.99)	ขาหมูทอดส้มตำ (0.99)
ข้าวผัดหนำเลี้ยบ	ปอเปี๊ยะทอดเจ (1.00)	ข้าวราดไข่เจียวหมูสับ (0.97)	ไข่เจียวหมูสับ (0.96)	ทอดมันข้าวโพดกุ้งสับ (0.90)	ยำปลาหมึก (0.90)
น้ำเขียวมะนาวโซดา	กุ้งผัดหน่อไม้ฝรั่ง (0.83)	ข้าวผัดซีอิ๊วกุ้ง (0.82)	น้ำอัญชัญมะนาวโซดา (0.78)	มะพร้าวอ่อนหวานเย็น (0.77)	ยำถั่วพลู (0.77)
