label	1st	2nd	3rd	4th	5th
ข้าวผัดกุ้ง	ข้าวผัดเขียวหวานกุ้ง (0.98)	ข้าวผัดน้ำพริกเผากุ้ง (0.97)	ข้าวผัดซีอิ๊วกุ้ง (0.90)	กต.ผัดแกงเขียวหวานกุ้ง (0.87)	แกงเขียวหวานกุ้ง (0.87)
ก๋วยเตี๋ยวหลอดลุยสวน	กต.หลอดทรงเครื่อง (0.56)	กต.หมูสับ (0.37)	กต.ผัดขี้เมาหมู (0.36)	กต.ทรงเครื่อง (0.36)	กต.ราดหน้าทะเล (0.35)
คอหมูย่าง	ส้มตำคอหมูย่าง (0.91)	ยำคอหมูย่าง (0.88)	ข้าวหน้าคอหมูย่าง ไข่ดองซีอิ๊ว (0.62)	หมูสะเต๊ะ (0.61)	แกงป่าหมู (0.59)
เมี่ยงชะพลู	เมี่ยงเห็ด (0.37)	กะเพราหมูกรอบ (0.28)	ผัดผักรวมมิตรหมู (0.28)	กะเพราหมู (0.27)	กะเพรากุ้ง (0.26)
ทอดมันข้าวโพดกุ้งสับ	ไข่เจียวกุ้งสับ (0.84)	ทอดมันกุ้ง (0.81)	แกงป่ากุ้ง (0.73)	ต้มข่ากุ้ง (0.73)	แกงเขียวหวานกุ้ง (0.73)
ผัดผักกะเฉดไฟแดง	ผัดผักกะเฉด (0.93)	เส้นหมี่ผัดกะเฉด (0.83)	เส้นหมี่ผัดกะเฉดไก่ (0.76)	ยำผักกะเฉด (0.75)	เส้นหมี่ผัดกะเฉดหมู (0.75)
ปอเปี๊ยะข้าวเหนียวไก่ทอด	โรตีแกงเขียวหวานหมู (0.56)	ข้าวผัดน้ำพริกเผาหมู (0.55)	ข้าวผัดหมูยอ (0.53)	ข้าวผัดเขียวหวานหมู (0.52)	กต.ผัดแกงเขียวหวานหมู (0.52)
แกงจืดไข่น้ำ	แกงจืดลูกรอก (0.78)	แกงจืดรวมมิตร (0.68)	แกงจืดเต้าหู้ วุ้นเส้น หมูสับ (0.66)	แกงจืดหมูสับสาหร่าย (0.65)	แกงจืดเต้าหู้ หมูสับ สาหร่าย (0.61)
แกงเผ็ดยอดมะพร้าวกุ้ง	แกงเผ็ดยอดมะพร้าวหมู (0.74)	แกงเผ็ดยอดมะพร้าวไก่ (0.73)	แกงป่ากุ้ง (0.62)	แกงเขียวหวานกุ้ง (0.61)	ทอดมันกุ้ง (0.60)
น้ำพริกกะปิปลาทูทอด	ข้าวผัดน้ำพริกกะปิปลาทูทอด (0.94)	ปลาทูทอด (0.75)	แกงส้มปลาช่อน ทอด (0.72)	น้ำพริกกะปิ (0.72)	ปลาช่อนทอดส้มตำ (0.72)
มะม่วงมะพร้าวปั่น	มะม่วงปั่น (0.82)	น้ำมะพร้าวปั่น (0.61)	มะยงชิดปั่น (0.53)	น้ำส้มปั่น (0.48)	น้ำมะนาวปั่น (0.45)
ทอดมันกุ้ง	แกงป่ากุ้ง (0.92)	ต้มข่ากุ้ง (0.92)	แกงเขียวหวานกุ้ง (0.90)	กต.ผัดแกงเขียวหวานกุ้ง (0.86)	ข้าวผัดกุ้ง (0.85)
เบียร์ไฮเนเก้น	เบียร์สิงห์ (0.50)	สลัดแฮม (0.00)	หอยแมลงภู่นิวซีแลนด์อบเนยกระเทียม (0.00)	กต.หลอดทรงเครื่อง (0.00)	ปลาหมึกทอดกระเทียมพริกไทย (0.00)
แกงเขียวหวานลูกชิ้นปลากราย	โรตีแกงเขียวหวานลูกชิ้นปลากราย (0.95)	ข้าวผัดเขียวหวานปลากราย (0.85)	แกงป่าปลากราย (0.85)	ขนมจีบปลากราย (0.80)	ปลากะพงผัดฉ่า (0.62)
น้ำมะพร้าวปั่น	น้ำสับปะรดปั่น (0.87)	น้ำแคนตาลูปปั่น (0.87)	น้ำมะนาวปั่น (0.87)	น้ำลิ้นจี่ปั่น (0.85)	น้ำแตงโมปั่น (0.85)
หอยแมลงภู่นิวซีแลนด์ส่วนกะทะร้อน	กุ้งส่วนกะทะร้อน (0.64)	หอยแมลงภู่นิวซีแลนด์อบหม้อดิน (0.61)	หอยแมลงภู่นิวซีแลนด์อบเนยกระเทียม (0.46)	หอยแมลงภู่นิวซีแลนด์ผัดผงกะหรี่ (0.42)	เนื้อออสเตรเลียผัดน้ำมันหอย (0.41)
ชามะนาว	น้ำผึ้งมะนาว (0.55)	น้ำอัญชัญมะนาวโซดา (0.34)	ชาดำเย็น (0.34)	ไก่มะนาว (0.30)	ชาจีน (0.27)
จุ๋ยก๊วย	สลัดแฮม (0.00)	หอยแมลงภู่นิวซีแลนด์อบเนยกระเทียม (0.00)	กต.หลอดทรงเครื่อง (0.00)	ปลาหมึกทอดกระเทียมพริกไทย (0.00)	พล่ากุ้ง (0.00)
ชาจีน	ชาไทย (0.62)	เฉาก๊วย ชาไทย (0.60)	ไอศครีมชาไทย (0.52)	ชามะนาว (0.27)	ชาดำเย็น (0.07)
เต้าหู้น้ำแดง	น้ำแดงมะนาวโซดา (0.67)	เต้าหู้น้ำแดงเจ (0.65)	น้ำกระเจี๊ยบ (0.65)	น้ำขิง (0.65)	น้ำปลาเห็ดฟาง (0.64)
ปลาดอรี่ขี้เมากะเพรากรอบ	ปลาดุกฟูขี้เมากะเพรากรอบ (0.57)	ข้าวผัดเขียวหวานปลากราย (0.54)	ปลากะพงทอดกรอบ (0.53)	โรตีแกงเขียวหวานลูกชิ้นปลากราย (0.51)	ผัดมะกะโรนีขี้เมากะเพรากรอบกุ้ง (0.49)
เส้นหมี่ผัดกะเฉดกุ้ง	เส้นหมี่ผัดกะเฉด (0.88)	เส้นหมี่ผัดกะเฉดหมู (0.87)	เส้นหมี่ผัดกะเฉดไก่ (0.86)	เส้นหมี่ผัดกะเฉดทะเล (0.80)	ผัดผักกะเฉด (0.80)
ซี่โครงขลุกขลิก	ขาหมูทอดส้มตำ (0.19)	โรตีแกงเขียวหวานเนื้อ (0.19)	แกงเขียวหวานเนื้อพริกขี้หนู (0.18)	ยำเนื้อออสเตรเลียย่าง (0.17)	ข้าวผัดเขียวหวานเนื้อ (0.17)
ทะเลรวมผัดฉ่า	ห่อหมกทะเล (0.45)	แกงส้มทะเล (0.40)	ผัดไทยทะเล (0.37)	ข้าวผัดทะเล (0.36)	ยำทะเล (0.34)
น้ำส้มปั่น	มะยงชิดปั่น (0.75)	มะม่วงปั่น (0.67)	น้ำแคนตาลูปปั่น (0.48)	มะม่วงมะพร้าวปั่น (0.48)	น้ำมะนาวปั่น (0.46)
เส้นหมี่ผัดกะเฉดหมู	เส้นหมี่ผัดกะเฉดไก่ (0.91)	เส้นหมี่ผัดกะเฉด (0.88)	เส้นหมี่ผัดกะเฉดกุ้ง (0.87)	ผัดผักกะเฉด (0.79)	เส้นหมี่ผัดกะเฉดทะเล (0.78)
มัสมั่นไก่	ต้มข่าไก่ (0.95)	แกงป่าไก่ (0.93)	แกงเขียวหวานไก่ (0.90)	ผัดไทยไก่ (0.83)	กต.ผัดแกงเขียวหวานไก่ (0.83)
ห่อหมกทะเล	ผัดไทยทะเล (0.81)	แกงส้มทะเล (0.78)	ข้าวผัดทะเล (0.74)	กะเพราทะเล (0.73)	ยำทะเล (0.67)
กะเพราหมู	แกงป่าหมู (0.84)	แกงเขียวหวานหมู (0.82)	หมูสะเต๊ะ (0.80)	แกงเขียวหวานหมูพริกขี้หนู (0.79)	หมูแดดเดียว (0.78)
กุ้งแช่น้ำปลา	ข้าวผัดน้ำพริกเผาปลาหมึก (0.49)	กต.ผัดแกงเขียวหวานกุ้ง (0.48)	ข้าวผัดน้ำพริกเผากุ้ง (0.48)	ข้าวผัดน้ำพริกเผาเนิ้อ (0.47)	ข้าวผัดเขียวหวานกุ้ง (0.47)
ข้าวราดกะเพราเจ	ข้าวราดกะเพราหมูกรอบ (0.65)	กะเพราหมูสับเจ (0.64)	กะเพราหมูกรอบเจ (0.62)	ข้าวราดกะเพราปลาหมึก (0.61)	ข้าวราดกะเพราไก่ (0.59)
น้ำมะพร้าว	น้ำมะพร้าวปั่น (0.82)	น้ำมะนาว (0.79)	น้ำมะตูม (0.79)	น้ำขิง (0.77)	น้ำกระเจี๊ยบ (0.74)
น้ำใบเตย	น้ำมะตูม (0.70)	น้ำกระเจี๊ยบ (0.64)	น้ำปลาเห็ดฟาง (0.63)	น้ำขิง (0.62)	น้ำมะนาว (0.61)
ข้าวผัดหมู	ข้าวผัดเขียวหวานหมู (0.98)	ข้าวผัดน้ำพริกเผาหมู (0.96)	ข้าวผัดซีอิ๊วหมู (0.89)	กต.ผัดแกงเขียวหวานหมู (0.86)	แกงเขียวหวานหมู (0.85)
น้ำตะไคร้	น้ำส้มคั้น (0.14)	น้ำอัญชัญมะนาวโซดา (0.12)	น้ำเก็กฮวยรสน้ำผึ้ง (0.08)	น้ำมะนาวโซดา (0.08)	น้ำอัญชัญมะนาว (0.05)
เฉาก๊วยลูกชิดขนุน	สาคูแคนตาลูป (0.32)	มะยงชิดลอยแก้ว (0.29)	มะพร้าวอ่อนหวานเย็น (0.24)	มะม่วงมะพร้าวปั่น (0.22)	ลิ้นจี่ลอยแก้ว (0.21)
ไอศกรีมกะทิสด	ไอศครีมวานิลา (0.55)	ไอศครีมช็อกโกแลต (0.44)	แกงเลียงกุ้งสด (0.41)	ข้าวผัดพริกสดปลาหมึก (0.40)	ผัดไทยกุ้งสด (0.40)
น้ำตะไคร้ร้อน	โอวัลตินร้อน (0.85)	น้ำขิงร้อน (0.55)	น้ำมะตูมร้อน (0.53)	ออส่วนกระทะร้อน (0.29)	กุ้งส่วนกะทะร้อน (0.26)
น้ำมะตูม	น้ำขิง (0.84)	น้ำกระเจี๊ยบ (0.81)	น้ำมะตูมร้อน (0.81)	น้ำมะนาว (0.80)	น้ำมะพร้าว (0.79)
ข้าวหมูกรอบคั่วพริกเกลือไข่เป็ดดาว	หมูกรอบผัดพริกเกลือ (0.60)	ข้าวผัดพริกสดไก่ (0.55)	ข้าวผัดพริกสดหมู (0.52)	เนื้อปลากะพงทอดพริกไทยดำ (0.52)	หมูทอดกระเทียมพริกไทย (0.51)
ปลากะพงผัดฉ่า	ปลากะพงแป๊ะซะ (0.97)	ปลากะพงสามรส (0.97)	ปลากะพงทอดน้ำปลา (0.81)	แกงส้มปลากะพง ตัว (0.79)	ปลากะพงนึ่งซีอิ๊ว (0.76)
แพนงหมู	แพนงไก่ (0.73)	แพนงกุ้ง (0.63)	แกงป่าหมู (0.48)	ลาบหมู (0.47)	หมูแดดเดียว (0.45)
ข้าวหน้าหมูทอดกระเทียม	ข้าวหน้าปลาหมึกทอดกระเทียม (0.89)	ข้าวหน้ากุ้งทอดกระเทียม (0.88)	ข้าวหน้าไก่ทอดกระเทียม (0.81)	หมูทอดกระเทียมพริกไทย (0.80)	ข้าวราดกะเพราหมู (0.75)
ต้มยำโป๊ะแตก	ต้มยำรวมมิตร (0.72)	ไข่ตุ๋นต้มยำทะเลหม้อไฟ (0.48)	ยำวุ้นเส้น (0.45)	ต้มยำไก่ (0.40)	ยำกุนเชียง (0.37)
ไข่ชะอมทอด	ปลาทูทอด (0.69)	แกงส้มปลาช่อน ทอด (0.66)	แกงส้มชะอมไข่ (0.64)	ลาบทอด (0.63)	ปลาหมึกทอดกระเทียมพริกไทย (0.61)
ไข่ตุ๋นต้มยำทะเลหม้อไฟ	ข้าวผัดทะเล (0.73)	กต.ทะเลน้ำพริกเผา (0.70)	ผัดไทยทะเล (0.69)	ยำทะเล (0.65)	กต.ราดหน้าทะเล (0.63)
โรตีแกงเขียวหวานหมู	กต.ผัดแกงเขียวหวานหมู (0.92)	แกงเขียวหวานหมู (0.92)	ผัดไทยหมู (0.85)	ข้าวผัดเขียวหวานหมู (0.83)	แกงป่าหมู (0.83)
ปลาหมึกผัดผงกระหรี่	ข้าวผัดผงกระหรี่ปลาหมึก (0.90)	ปูนิ่มผัดผงกระหรี่ (0.84)	ข้าวผัดผงกระหรี่กุ้ง (0.82)	ข้าวผัดผงกระหรี่ไก่ (0.79)	ข้าวผัดผงกระหรี่หมู (0.79)
แกงส้มกุ้ง	ข้าวผัดน้ำพริกกะปิปลาทูทอด (0.48)	ผัดผักรวมมิตรหมูกรอบ (0.43)	แกงส้มปลาช่อน ทอด (0.43)	ถั่วฝักยาวผัดพริกขิงหมูกรอบ (0.43)	หมูกรอบผัดพริกเกลือ (0.42)
ไก่ผัดเม็ดมะม่วงหิมพานต์	กุ้งผัดเม็ดมะม่วงหิมพานต์ (0.83)	ผัดมะกะโรนีไก่ (0.69)	เส้นหมี่ผัดกะเฉดไก่ (0.68)	เต้าหู้ผัดพริกกระเทียม (0.68)	กุ้งผัดผงกะหรี่ (0.66)
ยำผักบุ้งกรอบ	ยำชะพลูกรอบ (0.90)	ยำผักบุ้งกรอบเจ (0.62)	ยำกุนเชียง (0.60)	ยำตะไคร้ (0.54)	ผัดมะกะโรนีขี้เมากะเพรากรอบกุ้ง (0.53)
ขาหมูทอดส้มตำ	น้ำพริกหนุ่มหมูทอด (0.76)	ปลาช่อนทอดส้มตำ (0.72)	ข้าวหน้าหมูทอดกระเทียม (0.69)	หมูทอดกระเทียมพริกไทย (0.68)	หมูสะเต๊ะ (0.67)
ยำทะเล	ผัดไทยทะเล (0.69)	ข้าวผัดทะเล (0.68)	แกงส้มทะเล (0.68)	ห่อหมกทะเล (0.67)	ไข่ตุ๋นต้มยำทะเลหม้อไฟ (0.65)
ต้มแซ่บหมูเด้ง	ต้มแซ่บหมูนุ่ม (0.85)	ต้มแซ่บกระดูกหมู (0.79)	ต้มแซบกระดูกหมูอ่อน (0.66)	แกงป่าหมู (0.63)	แกงเขียวหวานหมู (0.61)
ชาดำเย็น	โกโก้เย็น (0.41)	โอวัลตินเย็น (0.37)	ชามะนาว (0.34)	ชาจีน (0.07)	โอวัลตินร้อน (0.04)
ปลาทูทอด	ลาบทอด (0.76)	ปลาช่อนทอดส้มตำ (0.76)	แกงส้มปลาช่อน ทอด (0.75)	น้ำพริกกะปิปลาทูทอด (0.75)	ข้าวผัดน้ำพริกกะปิปลาทูทอด (0.71)
แกงจืดเต้าหู้สาหร่ายเจ	แกงจืดเต้าหู้วุ้นเส้น สาหร่ายเจ (0.95)	เต้าหู้ผัดกะเพราเจ (0.82)	เต้าหู้ผัดถั่วงอกเจ (0.71)	เต้าหู้ทอดเจ (0.71)	ต้มยำเห็ดเจ (0.67)
ต้มโคล้งปลาดุกฟู	ยำปลาดุกฟู (0.75)	ปลาดุกฟูขี้เมากะเพรากรอบ (0.49)	ปลาช่อนแป๊ะซะ (0.12)	ปลากะพงผัดฉ่า (0.12)	แกงส้มเนื้อปลากะพง ไข่ชะอม (0.12)
ก๋วยเตี๋ยวราดหน้าเจ	กต.ผัดไทยเจ (0.90)	กต.ต้มยำเจ (0.88)	กต.หลอดเจ (0.77)	ส้มตำเจ (0.67)	ต้มยำเจ (0.65)
ขนมจีบปลากราย	แกงป่าปลากราย (0.89)	แกงเขียวหวานลูกชิ้นปลากราย (0.80)	ข้าวผัดเขียวหวานปลากราย (0.78)	โรตีแกงเขียวหวานลูกชิ้นปลากราย (0.74)	ปลาเปรี้ยวหวาน (0.54)
มะพร้าวอ่อนหวานเย็น	ไอศครีมวานิลา (0.35)	มะยงชิดลอยแก้ว (0.27)	สาคูแคนตาลูป (0.27)	ข้าวอบสัปปะรด (0.26)	ไอศครีมช็อกโกแลต (0.25)
แปะก๋วยกระปุก	แปะก๋วยซอง (0.70)	แปะก๋วย 3 ซอง (0.67)	แปะก๋วย 3 กระปุก (0.67)	สลัดแฮม (0.00)	คะน้าปลาเค็ม (0.00)
น้ำมะนาว	น้ำมะนาวโซดา (0.90)	น้ำเขียวมะนาวโซดา (0.85)	น้ำขิง (0.83)	น้ำมะนาวปั่น (0.83)	น้ำแดงมะนาวโซดา (0.82)
พล่าปลาช่อน	ปลาช่อนแป๊ะซะ (0.73)	ปลาช่อนแดดเดียว (0.68)	พล่ากุ้ง (0.57)	ปลาช่อนทอดส้มตำ (0.47)	แกงส้มปลาช่อน ทอด (0.46)
หอยแมลงภู่นิวซีแลนด์อบเนยกระเทียม	หอยแมลงภู่นิวซีแลนด์อบหม้อดิน (0.77)	ปลาหมึกทอดกระเทียมพริกไทย (0.58)	กุ้งทอดกระเทียมพริกไทย (0.57)	หอยแมลงภู่นิวซีแลนด์ผัดผงกะหรี่ (0.57)	ปลาหมึกผัดกระเทียม (0.52)
แกงเขียวหวานหมู	กต.ผัดแกงเขียวหวานหมู (0.97)	แกงป่าหมู (0.93)	โรตีแกงเขียวหวานหมู (0.92)	หมูสะเต๊ะ (0.89)	แกงเขียวหวานหมูพริกขี้หนู (0.89)
ก๋วยเตี๋ยวหลอดทรงเครื่อง	กต.ทรงเครื่อง (0.76)	กต.หมูสับ (0.62)	กต.ราดหน้าปลาหมึก (0.56)	กต.หลอดลุยสวน (0.56)	กต.ผัดขี้เมาไก่ (0.51)
ปลาหมึกทอดกระเทียมพริกไทย	กุ้งทอดกระเทียมพริกไทย (0.90)	หมูทอดกระเทียมพริกไทย (0.86)	ปลาหมึกผัดกระเทียม (0.82)	ปลากะพงทอดกระเทียม (0.80)	ข้าวหน้าปลาหมึกทอดกระเทียม (0.77)
พล่ากุ้ง	แกงป่ากุ้ง (0.88)	ต้มข่ากุ้ง (0.88)	ทอดมันกุ้ง (0.85)	แกงเขียวหวานกุ้ง (0.83)	ลาบกุ้ง (0.80)
ต้มยำเนื้อปลากะพง	ต้มข่าเนื้อปลากะพง (0.96)	เนื้อปลากะพงสามรส (0.95)	กะเพราเนื้อปลากะพง (0.92)	เนื้อปลากะพงมะนาว (0.88)	แกงส้มเนื้อปลากะพง ทอด (0.87)
หมูกรอบผัดพริกเกลือ	เต้าหู้ผัดพริกกระเทียม (0.84)	กะหล่ำปลีผัดน้ำปลา (0.82)	ถั่วฝักยาวผัดพริกขิงหมูกรอบ (0.81)	ผัดผักรวมมิตรหมูกรอบ (0.77)	ปลาหมึกผัดไข่เค็ม (0.76)
ก๋วยเตี๋ยวต้มยำกุ้งน้ำข้น	เต้าหู้น้ำแดง (0.50)	น้ำมะตูม (0.46)	น้ำขิง (0.46)	น้ำมะนาว (0.45)	น้ำกระเจี๊ยบ (0.44)
ข้าวผัดกระเทียม	ปลาหมึกผัดกระเทียม (0.75)	เต้าหู้ผัดพริกกระเทียม (0.74)	ไก่ทอดกระเทียมพริกไทย (0.71)	ซี่โครงหมูทอดกระเทียมพริกไทย (0.68)	ปลาหมึกทอดกระเทียมพริกไทย (0.66)
แปะก๋วยซอง	แปะก๋วย 3 ซอง (0.72)	แปะก๋วย 3 กระปุก (0.72)	แปะก๋วยกระปุก (0.70)	สลัดแฮม (0.00)	คะน้าปลาเค็ม (0.00)
แกงส้มปลากะพงตัว	ปลากะพงผัดฉ่า (0.79)	ปลากะพงแป๊ะซะ (0.78)	ปลากะพงสามรส (0.77)	แกงส้มปลาทูน่า (0.76)	แกงส้มเนื้อปลากะพง ไข่ชะอม (0.71)
แกงส้มผักรวม	ผัดเห็ดรวม (0.42)	ผัดผักรวมมิตร (0.42)	ผัดผักรวมมิตรหมูกรอบ (0.37)	ผัดผักรวมมิตรกุ้ง (0.36)	แกงส้มชะอมไข่ (0.31)
ต้มข่าเนื้อปลากะพง	เนื้อปลากะพงสามรส (0.98)	ต้มยำเนื้อปลากะพง (0.96)	กะเพราเนื้อปลากะพง (0.94)	เนื้อปลากะพงมะนาว (0.90)	แกงส้มเนื้อปลากะพง ทอด (0.87)
คะน้าปลาเค็ม	คะน้าหมูกรอบ (0.75)	ผัดผักรวมมิตรหมูกรอบ (0.46)	ถั่วฝักยาวผัดพริกขิงหมูกรอบ (0.46)	กะหล่ำปลีผัดน้ำปลา (0.42)	ยำคะน้ากุ้งสด (0.41)
กะเพราปลาหมึก	กะเพรากุ้ง (0.67)	ข้าวผัดปลาหมึก (0.66)	ปลาหมึกแดดเดียว (0.65)	ข้าวผัดน้ำพริกเผาปลาหมึก (0.65)	ข้าวราดกะเพราปลาหมึก (0.65)
นมชมพู	เฉาก๊วย นมชมพู (0.87)	ผักกาดขาวน้ำมันหอย (0.02)	สลัดแฮม (0.00)	คะน้าปลาเค็ม (0.00)	กต.หลอดทรงเครื่อง (0.00)
ปลากะพงนึ่งซีอิ๊ว	ปลากะพงนึ่งมะนาว (0.86)	ปลากะพงนึ่งบ๊วย (0.85)	ปลากะพงทอดน้ำปลา (0.77)	ปลากะพงสามรส (0.77)	ปลากะพงแป๊ะซะ (0.76)
ข้าวหน้าคอหมูย่างไข่ดองซีอิ๊ว	ข้าวหน้าหมูทอดกระเทียม (0.73)	ข้าวราดกะเพราหมูชาบู (0.70)	ข้าวราดกะเพราหมู (0.68)	ยำคอหมูย่าง (0.66)	ส้มตำคอหมูย่าง (0.65)
