label	1st	2nd	3rd	4th	5th
เปปเปอร์มิ้นท์ช็อคโกแลตเย็น	ออเรนจ์โซดา (0.92)	ชารีฟิล (0.82)	ข้าวแกงกะหรี่เนื้อสไลด์ออสเตรเลีย. (0.74)	ราเมงเนื้อสไลด์ออสเตรเลีย. (0.30)	สันคอสไลด์ (0.19)
P18. สปาเก็ตตี้ไวท์ซอสครีมไข่กุ้ง	P25. สปาเก็ตตี้โบลองเนสซอสเผ็ดแฮมชีส (0.75)	Honey Lemon (0.32)	ข้าวหน้าเนื้อ นิกุด้ง. (0.31)	P51. ซีซ่าสลัด (0.22)	P16. สปาเก็ตตี้หอยเชลล์ผัดน้ำมันมะกอก (0.22)
P6. ผักโขมอบชีส	P2. สปาเก็ตตี้สาหร่ายไข่กุ้ง (0.73)	P51. ซีซ่าสลัด (0.73)	P16. สปาเก็ตตี้หอยเชลล์ผัดน้ำมันมะกอก (0.73)	P5. ซุปไวท์ครีมเห็ด (0.16)	โรล Maki กุ้งเทมปุระ (0.10)
Mocha	ข้าวหน้าไก่ทอดโทริคัตสึ. (0.83)	ชารีฟีล (0.72)	ปูอัดทอดกรอบ. (0.27)	ไก่ทอดคาราเกะ. (0.23)	คัปปุชชีโนร้อน (0.15)
กึ๋นไก่	ตับหมู (0.66)	สะโพกไก่ (0.55)	สามชั้นสไลด์ (0.54)	ตับไก่ (0.41)	Asahi Can (0.37)
ตับหมู	สามชั้นสไลด์ (0.66)	กึ๋นไก่ (0.66)	สะโพกไก่ (0.61)	ตับไก่ (0.45)	Asahi Can (0.39)
สามชั้นสไลด์	ตับหมู (0.66)	สะโพกไก่ (0.55)	กึ๋นไก่ (0.54)	ตับไก่ (0.41)	Asahi Can (0.37)
Extra spaggetti	มิกซ์เบอรี่โยเกิร์ตสมูทตี้ (0.40)	ช็อคโกแลตเย็น (0.22)	สปาเก็ตตี้ซอสครีมต้มยำแฮมไข่กุ้ง (0.20)	สปาเก็ตตี้คาโบนาร่า (0.16)	คัปปุชชีโนเย็น (0.06)
เอสเปรสโซ่เย็น	มิกซ์เบอรี่โยเกิร์ตสมูทตี้ (0.71)	สปาเก็ตตี้ซอสครีมต้มยำแฮมไข่กุ้ง (0.36)	สปาเก็ตตี้คาโบนาร่า (0.28)	P47. โทสต์ไข่ข้นเห็ดแชมปิญอง (0.14)	โทสต์ไข่ข้นเห็ดแชมปิญอง (0.05)
เนื้อไก่ย่างเกลือ	มัทฉะ รีฟิล (0.57)	Extraกุ้ง (0.38)	ถั่วแขกผัดซอสโชสุ (0.27)	ขนมปังอบชีส (0.25)	Extra Ham (0.23)
มัทฉะเอสเปรสโซ่เย็น	Matcha Latte (0.26)	cake apple (0.23)	สลัดปลาทูน่าสด (0.22)	อเมริกาโน่เย็น (0.19)	ออเรนจ์เอสเปรสโซ่เย็น (0.17)
Matcha Latte	ออเรนจ์เอสเปรสโซ่เย็น (0.62)	อเมริกาโน่เย็น (0.61)	สตอเบอรี่โยเกิร์ตสมูทตี้ (0.46)	ทาร์ตมะม่วงเสาวรส (0.35)	มัทฉะเอสเปรสโซ่เย็น (0.26)
แพสชันฟรุ๊ตเย็น	Honey milk (0.80)	เบคอน (0.71)	peppermint chocolet (0.45)	redWine (0.34)	Banoffee Cale (0.31)
โคโคนัทเอสเปรสโซ่เย็น	American breakfast (0.39)	พานาคอตต้ายูซุ (0.35)	พานาคอตต้าสตอเบอรี่ (0.31)	คาราเมลมิลค์เย็น (0.27)	เลมอนฮันนี่โซดา (0.25)
Caramel Milk	น้ำมะฮานีเรมอลโชดา (0.65)	Caramel macchiato (0.64)	สปาเก็ตตี้หอยลายผัดฉ่า (0.63)	Extra หมูต้มยำ (0.30)	ฮันนี่มิลค์ปั่น (0.15)
cake yuzu	ชานมเย็น (0.86)	beer (0.17)	Honey Lemon Frappe (0.16)	สปาเก็ตตี้แซลมอนสไปซี่ (0.15)	Jasmine Refill (0.11)
ช็อคโกแลตร้อน	Vanila white coffee (0.52)	I17ตับหมู (0.15)	ข้าวไข่ข้นภูเขาไฟไข่ระเบิด (0.15)	pannacotta (0.14)	Pannacotta Strawberry (0.12)
คาราเมลมัคคิอาโต้เย็น	ทาร์ตมะม่วงเสาวรส (0.64)	Matcha latte Frappe (0.36)	เค้กแครอท (0.34)	Matcha Latte (0.24)	พานาคอตต้ายูซุ (0.24)
คาโบนาร่าซอสพริกศรีราชาไข่ออนเซ็น	Ice americano (0.17)	Passion Fruit Espresso (0.13)	ข้าวปลาแซลมอนย่าง. (0.12)	I17ตับหมู (0.10)	ยำเห็ดย่าง. (0.10)
Kiwi soda	ข้าวผัดซอสสไปซี่หมูเกาหลี (0.57)	orange soda (0.50)	Strawberry soda (0.50)	สปาเก็ตตี้ไวท์ซอสครีมเห็ดแชมปิยองแฮม (0.46)	Honey Lemon Soda (0.26)
Strawberry soda	ข้าวผัดซอสสไปซี่หมูเกาหลี (0.57)	orange soda (0.50)	Kiwi soda (0.50)	สปาเก็ตตี้ไวท์ซอสครีมเห็ดแชมปิยองแฮม (0.46)	Honey Lemon Soda (0.26)
orange soda	ข้าวผัดซอสสไปซี่หมูเกาหลี (0.57)	Kiwi soda (0.50)	Strawberry soda (0.50)	สปาเก็ตตี้ไวท์ซอสครีมเห็ดแชมปิยองแฮม (0.46)	Honey Lemon Soda (0.26)
เค้กแครอท	คาราเมลมัคคิอาโต้เย็น (0.34)	บรูคลินเชค (0.34)	บัตเตอร์ฟลายพีฮันนี่เลม่อนปั่น (0.26)	สปาเก็ตตี้ไวท์ซอสปูอัดไข่กุ้ง (0.25)	ทูน่าสลัด (0.24)
หมูทอดทงคตสึ	hot tea (0.00)	I13ไก่บดทรงเครื่องพริกรายู (0.00)	บูตะผัดมิโซะซอส (0.00)	สปาเก็ตตี้ปูอัดญี่ปุ่นผัดซอสโชยุ (0.00)	โรลปลาไหลย่างอโวคาโด. (0.00)
Soju	Orange cake (0.77)	สลัดเห็ดย่าง. (0.49)	ซูชิแซลมอนสด . (0.17)	Honey Lemon Espresso (0.17)	Iced Strawberry Soda (0.15)
beer	Espresso Passion Fruit (0.42)	cake yuzu (0.17)	ชานมเย็น (0.15)	Matcha Honey (0.13)	I1 เนื้อไก่ย่างเกลือ (0.09)
P3. ข้าวปลาแซลมอนย่างซัลซ่าอาโวคาโดแมงโก้	hot tea (0.00)	I13ไก่บดทรงเครื่องพริกรายู (0.00)	บูตะผัดมิโซะซอส (0.00)	สปาเก็ตตี้ปูอัดญี่ปุ่นผัดซอสโชยุ (0.00)	โรลปลาไหลย่างอโวคาโด. (0.00)
ไทยมิลค์ทีเย็น	สปาเก็ตตี้ไวท์ซอสครีมแฮม (0.76)	Coke (0.70)	เพรสโต้มังสวิรัติ (0.60)	ฮันนี่เลมอนเอสเปรสโซ่เย็น (0.13)	คัปปุชชีโน่ปั่น (0.07)
Honey milk	เบคอน (0.89)	แพสชันฟรุ๊ตเย็น (0.80)	บัตเตอร์ฟลายพีฮันนี่เลม่อนปั่น (0.22)	พานาคอตต้าสตอเบอรี่ (0.21)	เลมอนฮันนี่โซดา (0.18)
pannacotta	Avocado (0.79)	ซูชิหน้าปลาดิบรวม (0.37)	ข้าวหน้าเนื้อ นิกุด้ง. (0.27)	กุ้งฝอยทอดกรอบ. (0.26)	โรลแซลมอนพ่นไฟ ซอสไซเกียว. (0.17)
มัทฉะ รีฟิล	เนื้อไก่ย่างเกลือ (0.57)	ชาไทยเย็น (0.35)	Extra Ham (0.25)	Honey Lemon Frappe (0.23)	Extra_Parmesan_Cheese (0.12)
ไข่ปลาแซลมอน	ชาร้อนรีฟีล (0.81)	สลัดปลาทูน่า แซลมอนรวม (0.74)	Lemon tea (0.20)	สปาเก็ตตี้ผัดเห็ดซอสญี่ปุ่น (0.17)	ข้าวหน้าปลาไหลย่างซีอิ้ว. (0.15)
honey lemon	สปาเก็ตตี้ผัดฉ่ากุ้ง (0.69)	สปาเก็ตตี้เบคอนพริกแห้งผัดน้ำมันมะกอก (0.27)	ฟิชแอนด์ชิปส์ (0.24)	Matcha Honey (0.01)	Matcha Latte Frappe (0.01)
มัทฉะ รีฟีล	สปาเก็ตตี้ผัดฉ่ากุ้ง (0.69)	สปาเก็ตตี้เบคอนพริกแห้งผัดน้ำมันมะกอก (0.27)	ฟิชแอนด์ชิปส์ (0.24)	Matcha Honey (0.01)	Matcha Latte Frappe (0.01)
matcha refill	ต้มแซ่บหมู (0.32)	มัทฉะรีฟิล (0.16)	สลัดเห็ดย่าง. (0.15)	Honey lemon hot (0.12)	I10ไก่บดทรงเครื่องซอสสไปซี่ (0.12)
Yuzu Coffee	hot tea (0.00)	เต้าหู้ราดซอสญี่ปุ่น (0.00)	Banana Pudding Cake (0.00)	บูตะผัดมิโซะซอส (0.00)	สปาเก็ตตี้ปูอัดญี่ปุ่นผัดซอสโชยุ (0.00)
P47. โทสต์ไข่ข้นเห็ดแชมปิญอง	โทสต์ไข่ข้นเห็ดแชมปิญอง (0.35)	เค้กแครอท (0.19)	เอสเปรสโซ่เย็น (0.14)	อเมริกาโน่เย็น (0.12)	สปาเก็ตตี้ไวท์ซอสครีมเห็ดแชมปิยองแฮม (0.11)
ขนมปังอบชีส	สปาเก็ตตี้ผักขมมะเขือเทศน้ำมันมะกอก (0.81)	Extraกุ้ง (0.42)	Jasmine Refill (0.34)	ถั่วแขกผัดซอสโชสุ (0.29)	สปาเกตตี้เบคอนพริกแห้งมะกอก extra (0.28)
ไก่ย่างเกลือ	ถั่วแขกผัดซอสโชยุ (0.37)	กุ้งทอดคั่วพริกเกลือ. (0.33)	ไก่ทอดคาราเกะ. (0.32)	ราเมงไก่ทอดคาราเกะ. (0.25)	ข้าวหน้าหมูทอดทงคัตสึด้งตุ๋นไข่. (0.22)
ชาไทยเย็น	Honey Lemon Frappe (0.43)	มัทฉะ รีฟิล (0.35)	สปาเกตตี้กุ้งผัดซอสมะเขือ (0.27)	banofee (0.14)	แพสชันฟรุ๊ตเย็น (0.12)
เพสโต้ทูน่าสด	สลัดปลาแซลมอนย่าง. (0.68)	Orange (0.55)	Vanilla Black Tea (0.27)	สปาเก็ตตี้หอยลายผัดพริกเผา (0.18)	I1 เนื้อไก่ย่างเกลือ (0.16)
ชารีฟิล	ออเรนจ์โซดา (0.83)	เปปเปอร์มิ้นท์ช็อคโกแลตเย็น (0.82)	ข้าวแกงกะหรี่เนื้อสไลด์ออสเตรเลีย. (0.67)	Extraเป็นกุ้ง (0.37)	ราเมงเนื้อสไลด์ออสเตรเลีย. (0.29)
คัปปุชชีโน่ปั่น	ยำปูอัดพรีเมียม. (0.70)	ข้าวหน้าปลาแชลมอน~อโวคาโด~ไข่ปลา (0.65)	มัทฉะรีฟีล (0.40)	เค้กแครอท (0.16)	ยำสามอย่าง (0.12)
สปาเก็ตตี้ผักขมมะเขือเทศน้ำมันมะกอก	ขนมปังอบชีส (0.81)	สปาเกตตี้เบคอนพริกแห้งมะกอก extra (0.35)	Honey Milk Frappe (0.19)	Jasmine Refill (0.13)	คัปปุชชีโนเย็น (0.12)
สปาเก็ตตี้	hot tea (0.00)	เหล้าบ้วย (0.00)	Banana Pudding Cake (0.00)	บูตะผัดมิโซะซอส (0.00)	สปาเก็ตตี้ปูอัดญี่ปุ่นผัดซอสโชยุ (0.00)
ข้าวบูตะด้ง	สลัดแซลมอนย่าง (0.67)	ราเมงบูตะชาชู (0.67)	ข้าวหน้าไหลย่าง (0.67)	hot tea (0.00)	Extraเบคอน (0.00)
ข้าวหน้าไหลย่าง	สลัดแซลมอนย่าง (0.67)	ราเมงบูตะชาชู (0.67)	ข้าวบูตะด้ง (0.67)	hot tea (0.00)	Extraเบคอน (0.00)
ราเมงบูตะชาชู	สลัดแซลมอนย่าง (0.67)	ข้าวหน้าไหลย่าง (0.67)	ข้าวบูตะด้ง (0.67)	hot tea (0.00)	Extraเบคอน (0.00)
สลัดแซลมอนย่าง	ราเมงบูตะชาชู (0.67)	ข้าวหน้าไหลย่าง (0.67)	ข้าวบูตะด้ง (0.67)	hot tea (0.00)	Extraเบคอน (0.00)
Adam apple	hot tea (0.00)	เหล้าบ้วย (0.00)	Banana Pudding Cake (0.00)	บูตะผัดมิโซะซอส (0.00)	สปาเก็ตตี้ปูอัดญี่ปุ่นผัดซอสโชยุ (0.00)
Oat meal	I13ไก่บดทรงเครื่องพริกรายู (0.00)	บูตะผัดมิโซะซอส (0.00)	สปาเก็ตตี้ปูอัดญี่ปุ่นผัดซอสโชยุ (0.00)	โรลปลาไหลย่างอโวคาโด. (0.00)	Extra หอยเชลล์ (0.00)
Orange juice	PUDDINGBANANA (0.81)	เค้กช็อคโกแล็ต (0.14)	I17ตับหมู (0.11)	ปลาแซลมอนสดดองซีอิ้วญี่ปุ่น (0.10)	Iced Orange Soda (0.09)
Cappuccino	ยำปลาทูน่าสด. (0.47)	สปาเก็ตตี้หอยลายผัดพริกเผา (0.41)	Hot mocha (0.14)	ฮันนี่แบล็คคอฟฟี่ร้อน (0.14)	redWine (0.12)
อเมริกาโน่ร้อน	Hot mocha (0.52)	ฮันนี่แบล็คคอฟฟี่ร้อน (0.52)	สลัดอาโวคาโดกุ้งย่าง (0.38)	อาหารเช้าไข่ข้นและแชมปิฌอง (0.36)	Orange Espresso (0.31)
P16. สปาเก็ตตี้หอยเชลล์ผัดน้ำมันมะกอก	P6. ผักโขมอบชีส (0.73)	P2. สปาเก็ตตี้สาหร่ายไข่กุ้ง (0.56)	P51. ซีซ่าสลัด (0.56)	P18. สปาเก็ตตี้ไวท์ซอสครีมไข่กุ้ง (0.22)	โรล Maki กุ้งเทมปุระ (0.09)
P2. สปาเก็ตตี้สาหร่ายไข่กุ้ง	P6. ผักโขมอบชีส (0.73)	P16. สปาเก็ตตี้หอยเชลล์ผัดน้ำมันมะกอก (0.56)	P51. ซีซ่าสลัด (0.56)	P18. สปาเก็ตตี้ไวท์ซอสครีมไข่กุ้ง (0.22)	โรล Maki กุ้งเทมปุระ (0.09)
P51. ซีซ่าสลัด	P6. ผักโขมอบชีส (0.73)	P16. สปาเก็ตตี้หอยเชลล์ผัดน้ำมันมะกอก (0.56)	P2. สปาเก็ตตี้สาหร่ายไข่กุ้ง (0.56)	P18. สปาเก็ตตี้ไวท์ซอสครีมไข่กุ้ง (0.22)	โรล Maki กุ้งเทมปุระ (0.09)
apple cake	เค้กเลมอน (0.81)	ลาเต้เย็น (0.43)	สปาเก็ตตี้เพสโต้แฮม (0.25)	ลาเต้ร้อน (0.23)	คาราเมลมัคคิอาโต้ร้อน (0.20)
คาราเมลมัคคิอาโต้ร้อน	เค้กเลมอน (0.45)	American breakfast (0.29)	ลาเต้เย็น (0.27)	apple cake (0.20)	ซีซ่าสลัด (0.17)
มอคค่าเย็น	ข้าวไก่ทอดคาราเกะ. (0.77)	ปอเปี๊ยะเครื่องราเมง Signature (0.54)	ลาเต้เย็น (0.37)	เกี๊ยวซ่า 6 ชิ้น (0.29)	ฮันนี่เลมอนเย็น (0.24)
คาราเมลมิลค์เย็น	ฮันนี่มิลค์ปั่น (0.33)	ทาร์ตมะม่วงเสาวรส (0.32)	โคโคนัทเอสเปรสโซ่เย็น (0.27)	พานาคอตต้ายูซุ (0.26)	คัปปุชชีโนเย็น (0.25)
ไข่ข้นเบคอน	Extraเบคอน (0.00)	บูตะผัดมิโซะซอส (0.00)	สปาเก็ตตี้ปูอัดญี่ปุ่นผัดซอสโชยุ (0.00)	โรลปลาไหลย่างอโวคาโด. (0.00)	Extra หอยเชลล์ (0.00)
ฮันนี่เลมอนเอสเปรสโซ่เย็น	เค้กแฮมมิ่งเบริด์ (0.40)	ข้าวซูชิปลาแซลมอนพ่นไฟ ซอสเมนไต. (0.27)	ไก่ทอดคาราเกะ. (0.25)	ข้าวผัดซอสสไปซี่หมูเกาหลี (0.21)	ออเรนจ์เอสเปรสโซ่เย็น (0.17)
beer peach	Banoffee Cale (0.54)	เห็ดย่างรวม (0.53)	ช็อคโกแลตปั่น (0.51)	PUDDINGBANANA (0.45)	Honey Lemon Frappe (0.23)
ฮันนี่มิลค์เย็น	ข้าวแกงกะหรี่ภูเขาไฟไข่กุ้ง (0.52)	I4เนื้อไก่ย่างขิงหอม (0.38)	Extra (0.31)	Kiwi & Passion Fruit Frappe (0.25)	ชามะนาว (0.25)
peppermint chocolet	Banoffee Cale (0.68)	Extra ไข่กุ้ง (0.56)	Banoffee Cake (0.51)	แพสชันฟรุ๊ตเย็น (0.45)	extra cheese (0.37)
extra cheese	สปาเกตตี้เพสโต้กุ้ง (0.77)	สปาเก็ตตี้เพสโต้หอยเชลล์ (0.73)	Extra หอยเชล์ (0.51)	peppermint chocolet (0.37)	Banoffee Cale (0.26)
Matcha latte Frappe	ทาร์ตมะม่วงเสาวรส (0.67)	พานาคอตต้ายูซุ (0.65)	คาราเมลมัคคิอาโต้เย็น (0.36)	ออเรนจ์เอสเปรสโซ่เย็น (0.35)	สลัดปลาทูน่าสด (0.32)
honey lemon tart	Extra Beef (0.63)	Hot Thai harb tea (0.44)	Extra กุ้งทอด (0.32)	Extraเป็นเนื่อ (0.27)	extar shot (0.24)
ต้มแซ่บหมู	หมูสามชั้น 1 สะโพกไก่ 1 (0.47)	matcha refill (0.32)	Kiwi & Passion Fruit Frappe (0.14)	Matcha Honey (0.13)	I12 ไก่บดทรงเครื่องวาซาบิ (0.12)
spaghetti Spicy Carbonara with Ham Bacon	ข้าวแกงกะหรี่สันคอหมูสไลด์. (0.60)	Coke Zero (0.54)	cake (0.48)	มัทฉะรีฟีล (0.10)	สปาเก็ตตี้ผัดเห็ดซอสญี่ปุ่น (0.07)
ซุปผัดโขม	ข้าวแกงกะหรี่สันคอหมูสไลด์. (0.60)	Coke Zero (0.54)	cake (0.48)	มัทฉะรีฟีล (0.10)	สปาเก็ตตี้ผัดเห็ดซอสญี่ปุ่น (0.07)
มันฝรั่งบด	Bread Toast (0.61)	เพสโต้หอยเซลล์ (0.41)	i14ต้มหอมญี่ปุ่นอกไก่ (0.32)	I1 เนื้อไก่ย่างเกลือ (0.27)	ข้าวปลาแซลมอนย่าง (0.23)
สลัดปลาแซลมอนย่าง.	เพสโต้ทูน่าสด (0.68)	Orange (0.37)	Orange cake (0.36)	Vanilla Black Tea (0.22)	Extraเป็นกุ้ง (0.17)
ทาร์ตมะม่วงเสาวรส	Matcha latte Frappe (0.67)	คาราเมลมัคคิอาโต้เย็น (0.64)	พานาคอตต้ายูซุ (0.54)	Matcha Latte (0.35)	คาราเมลมิลค์เย็น (0.32)
สปาเก็ตตี้ไวท์ซอสปูอัดไข่กุ้ง	Yuzu Pannacotta (0.38)	ฮันนี่เลม่อนปั่น (0.33)	เค้กแครอท (0.25)	โรลแคลิฟอร์เนีย. (0.19)	สปาเก็ตตี้ไก่กรอบคั่วพริกเกลือ (0.16)
กีวี่และแพสชันฟรุ๊ตเย็น	Strawberry flavoured ceylon black tea (0.54)	พานาคอตต้ายูซุ (0.27)	เค้กพุดดิ้งกล้วยหอม (0.26)	ราเมงเนื้อสไลด์ออสเตรเลีย. (0.21)	โคโคนัทเอสเปรสโซ่เย็น (0.14)
ช็อคโกแลตปั่น	beer peach (0.51)	pot egg (0.38)	Banoffee Cale (0.37)	เห็ดย่างรวม (0.37)	PUDDINGBANANA (0.23)
เพรสโต้มังสวิรัติ	ไทยมิลค์ทีเย็น (0.60)	Coke (0.45)	ไก่ทอดคาราเกะ. (0.05)	บรูคลินเชค (0.04)	ข้าวผัดซอสสไปซี่หมูเกาหลี (0.04)
ชาร้อนรีฟีล	ไข่ปลาแซลมอน (0.81)	สลัดปลาทูน่า แซลมอนรวม (0.74)	Orvieto Classico (0.42)	Lemon tea (0.20)	สปาเก็ตตี้ผัดเห็ดซอสญี่ปุ่น (0.16)
Hot Vanilla White Coffee	หมูสามชั้นสไล 2 (0.62)	lemon cake (0.25)	ชาเขียวรีฟีล (0.22)	ซัลซ่าเนื้อออสเตรเลียสไลด์ย่าง (0.20)	singha Beer (0.18)
PUDDINGBANANA	Orange juice (0.81)	beer peach (0.45)	Banoffee Cale (0.24)	เห็ดย่างรวม (0.24)	ช็อคโกแลตปั่น (0.23)
ออเรนจ์โซดา	เปปเปอร์มิ้นท์ช็อคโกแลตเย็น (0.92)	ชารีฟิล (0.83)	ข้าวแกงกะหรี่เนื้อสไลด์ออสเตรเลีย. (0.75)	ราเมงเนื้อสไลด์ออสเตรเลีย. (0.30)	พานาคอตต้ายูซุ (0.21)
แพนเค็กมะพร้าว	เค้ก (0.36)	Banoffee (0.36)	Banoffee Cake (0.32)	สปาเก็ตตี้หอยเซล์พริกขี้หนูสวน (0.27)	Strawberry flavoured ceylon black tea (0.18)
Lemon Soda	สปาเกตตี้ข้าวซอยแซลมอนย่าง (0.63)	Extraเป็นเนื่อ (0.27)	Honey Lemon Espresso (0.22)	ราเมงไก่ทอดโทริคัตสึ. (0.20)	Iced Kiwi Soda (0.19)
i16 หมูสันคอสไลด์	Peach Yuzu Soda (0.61)	สปาเก็ตตี้โบลองเนสซอสเผ็ดแฮมชีส (0.43)	ข้าวหน้าหมูสันคอสันสไลด์ตุ๋นไข่. (0.23)	ข้าวแกงกะหรี่เห็ดโคนญี่ปุ่น. (0.19)	i18 หมู3ชั้นสไลด์ (0.18)
i17 ตับหมู	i6 กึ๋นไก่ย่าง (0.65)	Izakaya ย่างรวม 5 ไม้ (0.65)	ข้าวหน้าฮาโก๊ะ Signature (0.49)	i18 หมูสามชั้นสไลด์ (0.18)	ข้าวหน้าหมูสันคอสันสไลด์ตุ๋นไข่. (0.17)
i18 หมู3ชั้นสไลด์	i18 หมูสามชั้นสไลด์ (0.70)	ข้าวหน้าหมูสันคอสันสไลด์ตุ๋นไข่. (0.47)	ข้าวแกงกะหรี่เห็ดโคนญี่ปุ่น. (0.38)	Peach Soda (0.29)	ข้าวซูชิปลาแซลมอนสด. (0.23)
ย่างรวม 5 ไม้	ยำปลาทูน่าสด. (0.53)	ข้าวหน้าปลาไหลย่างซีอิ้ว. (0.46)	ซูชิดับเบิ้ลหน้ารวม (0.42)	ฮามาจิ ซาชิมิ 5 ชิ้น (0.35)	Strawberry Milk Cream (0.18)
เอสเปรสโซ่ร้อน	เค้กแอปเปิ้ลอัลมอนด์ (0.67)	คัปปุชชีโนร้อน (0.40)	อาหารเช้ากริลล์ผักรวมและไข่ข้น (0.12)	Hot americano (0.06)	ชารีฟีล (0.05)
