label	1st	2nd	3rd	4th	5th
Hot Latte	ข้าวแกงกะหรี่ดั้งเดิม. (0.44)	สปาเก็ตตี้ขี้เมาไก่กรอบ (0.38)	Matcha Espresso (0.28)	Iced Vanilla White Coffee (0.26)	โรลแคลิฟอร์เนีย. (0.26)
cake apple	สลัดปลาทูน่าสด (0.91)	cake (0.30)	มัทฉะเอสเปรสโซ่เย็น (0.23)	ข้าวปลาแซลมอนย่างซัลซ่าอาโวคาโดแมงโก้ (0.16)	ผักโขมอบชีส (0.15)
Iced Matcha Latte	hot Water (0.37)	กุ้งฝอยทอดกรอบ. (0.28)	Lemonade Black Tea (0.28)	Honey Lemon (0.27)	Matcha Honey (0.24)
Lemonade Black Tea	Strawberry Milk Cream (0.58)	วนิลาไวท์คอฟฟี่เย็น (0.37)	ราเมงไก่ทอดโทริคัตสึ. (0.30)	Iced Matcha Latte (0.28)	ข้าวซูชิปลาทูน่า อโวคาโด (0.27)
โรลแซลมอนอโวคาโด ซอสเทอริยากิ	strawberry milk (0.38)	lemon honey soda (0.35)	lemon honey (0.35)	lemon black tea (0.35)	โรลแซลมอนพ่นไฟ ซอสไซเกียว. (0.34)
ข้าวไข่ข้นต้มยำ	Coconut Espresso (0.28)	มัทฉะลาเต้เย็น (0.27)	ข้าวไข่ข้นกะเพราหมูคุโรบูตะสันคอสไลด์ (0.22)	ข้าวผัดสไปซี่ซีฟู้ดไข่ข้นปลาแซลมอนย่าง (0.22)	ไก่บดย่าง (0.20)
สปาเก็ตตี้ไก่กรอบคั่วพริกเกลือ	Butterfly Pea Honey Lemon Frappe (0.42)	สปาเก็ตตี้ไวท์ซอสสไปซี่ปูอัดไข่กุ้ง (0.35)	ไก่ทอดอาม่า (0.29)	สปาเก็ตตี้ภูเขาไฟไข่กุ้ง (0.25)	Caramel Milk Frappe (0.23)
Carrot Cake	ข้าวหน้าหมูทอดทงคัตสึด้งตุ๋นไข่. (0.41)	ข้าวหน้าไก่ย่างราดซอสเทอริยากิ. (0.40)	Apple Almond Cake (0.38)	Iced Orange Soda (0.29)	Hummingbird Cake (0.25)
Matcha Refill	ข้าวแกงกะหรี่ปลาทอด. (0.43)	ข้าวหน้าหมูทอดทงคัตสึ. (0.33)	ต้มยำกุ้ง (0.27)	ข้าวซูชิแซลมอน~ปลาฮามาจิ~ปลาทูน่า (0.26)	โรลทูน่า อโวคาโด. (0.24)
สปาเก็ตตี้คาโบนาร่า	มิกซ์เบอรี่โยเกิร์ตสมูทตี้ (0.33)	ข้าวไข่ข้นกะเพราหมูคุโรบูตะสันคอสไลด์ (0.32)	ชามะนาวร้อน (0.28)	Pure peppermint tea (0.28)	เอสเปรสโซ่เย็น (0.28)
สปาเก็ตตี้สามชีส	กะหล่ำดอกกริลล์ (0.34)	ยำผลไม้ (0.26)	Caramel Milk Frappe (0.26)	สปาเก็ตตี้คาโบนาร่าซอสเผ็ดหอยเชลล์ไข่กุ้ง (0.24)	Iced Peppermint Chocolate (0.21)
สปาเก็ตตี้เบคอนพริกแห้งผัดน้ำมันมะกอก	สปาเก็ตตี้ผัดฉ่ากุ้ง (0.38)	สปาเก็ตตี้ไวท์ซอสผักโขมแฮม (0.31)	มัทฉะ รีฟีล (0.27)	honey lemon (0.27)	ซีซ่าสลัด (0.25)
สปาเก็ตตี้เพสโต้แฮม	สปาเก็ตตี้ไวท์ซอสครีมไข่กุ้ง (0.34)	สปาเก็ตตี้คาโบราเมงหมูชาชู (0.32)	สปาเก็ตตี้ไวท์ซอสครีมเห็ดแชมปิยองแฮม (0.29)	แซลมอนซัลซ่ายูสุ (0.28)	เค้กเลมอน (0.27)
สปาเก็ตตี้โบลองเนสหมูซอสเผ็ด	Iced Butterfly Pea Honey Lemon (0.47)	วนิลาไวท์คอฟฟี่เย็น (0.25)	โทสต์ไข่ข้นผักโขมอาโวคาโดพร้อมซัลซ่ามะเขือเทศ (0.20)	ซูชิแซลมอนสด . (0.13)	I6กึ๋นไก่ย่าง (0.12)
สปาเก็ตตี้ไวท์ซอสผักโขมแฮม	Iced Mocha (0.42)	สปาเก็ตตี้เบคอนพริกแห้งผัดน้ำมันมะกอก (0.31)	หมูมะนาว (0.30)	ข้าวแกงกะหรี่เห็ดโคนญี่ปุ่น. (0.29)	ไก่ทอดอาม่า (0.24)
สปาเก็ตตี้กุ้งผัดพริกขี้หนูสวน	English breakfast tea (0.57)	Iced Americano (0.50)	Montepulciano (0.39)	สเต็กไก่ย่างพริกไทยดำ (0.36)	I15สะโพกไก่ย่าง (0.36)
สปาเก็ตตี้ครีมทรัฟเฟิลออยล์	strawberry milk (0.31)	สปาเก็ตตี้ปลาแซลมอนคั่วพริกเกลือ (0.30)	I7หัวใจไก่ย่าง (0.29)	lemon black tea (0.29)	lemon honey (0.29)
สปาเก็ตตี้หอยเชลล์ผัดน้ำมันมะกอก	สลัดไส้กรอกย่าง (0.39)	สปาเก็ตตี้ไวท์ซอสครีมไข่กุ้ง (0.26)	ต้มยำกุ้ง (0.24)	Banofee Cake (0.22)	ข้าวหน้าหมูทอดทงคัตสึ. (0.21)
มันบด	i16หมูสันคอสไลด์ (0.50)	i15 สะโพกไก่ (0.45)	i18หมูสามชั้นสไลด์ (0.45)	สปาเก็ตตี้ไวท์ซอสครีมเห็ด (0.45)	i19 เบคอนพันเห็ดเข็มทอง (0.26)
ฟิชแอนด์ชิปส์	สปาเก็ตตี้คาโบนาร่าซอสพริกศรีราชาไข่ออนเซ็น (0.36)	สปาเก็ตตี้ผัดฉ่ากุ้ง (0.35)	Banofee Cake (0.31)	Iced Caramel Milk (0.28)	สปาเก็ตตี้คาโบนาร่าซอสเผ็ดหอยเชลล์ไข่กุ้ง (0.26)
สปาเก็ตตี้คาโบนาร่าซอสพริกศรีราชาไข่ออนเซ็น	สปาเก็ตตี้สาหร่ายไข่กุ้ง (0.43)	ฟิชแอนด์ชิปส์ (0.36)	ผักโขมอบชีส (0.34)	ปลาหมึกทอด คารามารี (0.30)	Mix Berry Yogurt Smoothie (0.25)
สปาเก็ตตี้สาหร่ายไข่กุ้ง	สปาเก็ตตี้คาโบนาร่าซอสพริกศรีราชาไข่ออนเซ็น (0.43)	Iced Caramel Milk (0.24)	ทูน่าสลัด (0.24)	ผักโขมอบชีส (0.24)	ไก่ทอดอาม่า (0.23)
ผักโขมอบชีส	Hot latte (0.39)	สปาเก็ตตี้คาโบนาร่าซอสพริกศรีราชาไข่ออนเซ็น (0.34)	บัตเตอร์ฟลายพีฮันนี่เลม่อนเย็น (0.29)	สปาเก็ตตี้คาโบนาร่า (0.26)	สปาเก็ตตี้สาหร่ายไข่กุ้ง (0.24)
สปาเก็ตตี้ขี้เมาไก่ + ไข่ออนเซ็น	ซุปไวท์ครีมเห็ด (0.57)	Banana Pudding Cake (0.30)	ซีซ่าสลัด (0.24)	สปาเก็ตตี้คาโบนาร่า (0.16)	สปาเก็ตตี้เบคอนพริกแห้งผัดน้ำมันมะกอก (0.15)
Iced Americano	English breakfast tea (0.73)	สปาเก็ตตี้กุ้งผัดพริกขี้หนูสวน (0.50)	Iced Peppermint Chocolate (0.43)	สปาเก็ตตี้ปลาแซลมอนคั่วพริกเกลือ (0.32)	ไก่กรอบคั่วพริกเกลือ (0.23)
ข้าวหน้าหมูสันคอสันสไลด์ตุ๋นไข่.	ข้าวหน้าไก่ย่างราดซอสเทอริยากิ (0.65)	i18 หมู3ชั้นสไลด์ (0.47)	โรลแซลมอนพ่นไฟ เมนไตโกะ (0.47)	ข้าวแกงกะหรี่เห็ดโคนญี่ปุ่น. (0.35)	i18 หมูสามชั้นสไลด์ (0.32)
ข้าวแกงกะหรี่สันคอหมูสไลด์.	Coke Zero (0.65)	spaghetti Spicy Carbonara with Ham Bacon (0.60)	ซุปผัดโขม (0.60)	cake (0.58)	Peach Yuzu Soda (0.18)
ซีซ่าสลัด	Banana Pudding Cake (0.36)	สปาเก็ตตี้ไวท์ซอสครีมไข่กุ้ง (0.26)	สปาเก็ตตี้เบคอนพริกแห้งผัดน้ำมันมะกอก (0.25)	สปาเก็ตตี้ขี้เมาไก่ + ไข่ออนเซ็น (0.24)	สปาเก็ตตี้เพสโต้กุ้ง (0.24)
Mix Berry Yogurt Smoothie	Iced Honey Lemon (0.46)	ข้าวแกงกะหรี่ดั้งเดิม. (0.38)	Strawberry Yogurt Smoothie (0.31)	Iced Caramel Macchiato (0.25)	สปาเก็ตตี้คาโบนาร่าซอสพริกศรีราชาไข่ออนเซ็น (0.25)
ข้าวแกงกะหรี่หมูทอดทงคัตสึ.	ข้าวหน้าบูตะด้ง . (0.37)	เต้าหู้ตุ๋นหัวปลาแซลมอนซีอิ๊วญี่ปุ่น (0.37)	Singha Large (0.29)	แซลมอนซัลซ่ายูสุ (0.25)	ข้าวซูชิแซลมอน~ปลาฮามาจิ~ปลาทูน่า (0.25)
Coconut Espresso	ข้าวไข่ข้นต้มยำ (0.28)	สปาเก็ตตี้คาโบนาร่าซอสพริกศรีราชาไข่ออนเซ็น (0.22)	Hot Mocha (0.13)	Iced Matcha Latte (0.12)	Cranberry Chocolate cake (0.11)
ข้าวไข่ข้นกะเพราหมูคุโรบูตะสันคอสไลด์	ข้าวผัดสไปซี่ซีฟู้ดไข่ข้นปลาแซลมอนย่าง (0.41)	Pure peppermint tea (0.38)	ชามะนาวร้อน (0.38)	สตอเบอรี่โยเกิร์ตสมูทตี้ (0.33)	สปาเก็ตตี้คาโบนาร่า (0.32)
ราเมงหมูทอดทงคัตสึ.	สลัดปลาเงิน. (0.36)	เบคอนพันเห็ดเข็มทอง (0.32)	หมูสามชั้นย่าง (0.32)	แซลมอน ซาชิมิ 5 ชิ้น (0.31)	แซลมอนซัลซ่ายูสุ (0.27)
โค้ก	สลัดไก่ย่างฮันนี่มัสตาร์ด (0.34)	สปาเก็ตตี้สามชีส (0.20)	สเต็กเนื้อ (0.19)	Honey Lemon (0.18)	I7หัวใจไก่ย่าง (0.17)
Banofee Cake	Yuzu Panna Cotta (0.52)	ฟิชแอนด์ชิปส์ (0.31)	สปาเก็ตตี้ไวท์ซอสสไปซี่ปูอัดไข่กุ้ง (0.25)	สปาเก็ตตี้คาโบนาร่าซอสพริกศรีราชาไข่ออนเซ็น (0.24)	Chocolate Frappe (0.22)
Honey Lemon Soda	Strawberry Milk Cream (0.31)	ข้าวผัดซอสสไปซี่หมูเกาหลี (0.27)	Kiwi soda (0.26)	orange soda (0.26)	Strawberry soda (0.26)
Hummingbird Cake	Apple Almond Cake (0.31)	Carrot Cake (0.25)	Strawberry Milk Cream (0.17)	Lemonade Black Tea (0.13)	Chocolate Frappe (0.13)
Iced Thai Milk Tea	โรลปลาไหลย่างอโวคาโด. (0.42)	Honey Lemon (0.26)	ขนมปังกระเทียม (0.26)	เค้กฮัมมิงเบิร์ด (0.24)	สปาเก็ตตี้คาโบนาร่า (0.21)
ข้าวปลาแซลมอนย่างซัลซ่าอาโวคาโดแมงโก้	Iced Honey Lemon (0.28)	ไก่บดย่าง (0.23)	สันคอสไลต์ย่าง (0.23)	หัวใจไก่ย่าง (0.23)	i19 เบคอนพันเห็ดเข็มทอง (0.23)
สปาเก็ตตี้หอยลายผัดพริกเผา	Cappuccino (0.41)	บลูคลาสสิคลาเต้เย็น (0.25)	ยำปลาทูน่าสด. (0.20)	เพสโต้ทูน่าสด (0.18)	I12 ไก่บดทรงเครื่องวาซาบิ (0.18)
ข้าวกระเพราหมสับเก็บกิน	Caramel Milk Frappe (0.00)	Banana Pudding Cake (0.00)	บูตะผัดมิโซะซอส (0.00)	สปาเก็ตตี้ปูอัดญี่ปุ่นผัดซอสโชยุ (0.00)	โรลปลาไหลย่างอโวคาโด. (0.00)
Yuzu Soda	หัวหอมทอดกรอบ (0.34)	สปาเก็ตตี้ซอสพริกศรีราชาไข่ออนเซ็น (0.33)	ราเมงบูตะชาชู. (0.29)	ยำสาหร่ายวากาเมะ. (0.28)	วนิลาไวท์คอฟฟี่เย็น (0.26)
Yuzu Soda Flower	ข้าวซูชิปลาแซลมอนสด อโวคาโด (0.63)	เบคอนพันเห็ดเข็ม (0.56)	ตับไก่ 1 (0.56)	โรลปลาไหลย่างอโวคาโด. (0.50)	ข้าวแกงกะหรี่ไก่ทอดโทริคัตสึ. (0.30)
สปาเก็ตตี้ไส้กรอกผัดพริกขี้หนูสวน	Iced Latte (0.94)	ต้นหอมญี่ปุ่นอกไก่ (0.12)	สะโพกไก่ (0.10)	โทส (0.07)	คาราเมลมิลค์เย็น (0.06)
ข้าวผัดซอสสไปซี่หมูเกาหลี	Strawberry soda (0.57)	orange soda (0.57)	Kiwi soda (0.57)	Iced Vanilla White Coffee (0.52)	หนังปลาแซลมอนทอดกรอบ (0.50)
สปาเก็ตตี้ไวท์ซอสสไปซี่ปูอัดไข่กุ้ง	สปาเก็ตตี้ไก่กรอบคั่วพริกเกลือ (0.35)	Yuzu Panna Cotta (0.32)	ไก่ทอดอาม่า (0.32)	ยำหอยปีกนก (0.29)	Yuzu Soda Flower (0.25)
สปาเก็ตตี้ไส้กรอกคั่วพริกเกลือ	Banana Pudding Cake (0.32)	Strawberry Panna Cotta (0.17)	ซีซ่าสลัด (0.15)	หมูมะนาว (0.15)	Orange Espresso (0.12)
สปาเก็ตตี้ไวท์ซอสครีมไข่กุ้ง	สปาเก็ตตี้ปูอัดญี่ปุ่นผัดซอสโชยุ (0.34)	สปาเก็ตตี้เพสโต้แฮม (0.34)	ซีซ่าสลัด (0.26)	ไก่ทอดอาม่า (0.26)	สปาเก็ตตี้หอยเชลล์ผัดน้ำมันมะกอก (0.26)
ข้าวแกงกะหรี่ปลาทอด.	Matcha Refill (0.43)	ข้าวหน้าไก่ทอดโทริคัตสึด้งตุ๋นไข่. (0.18)	ผัดผักซอสไซเคียว (0.12)	สเต็กเนื้อ (0.07)	I19เบคอนพันเห็ดเข็มทอง (0.06)
ไก่กรอบคั่วพริกเกลือ	Kiwi & Passion Fruit (0.49)	สปาเก็ตตี้ภูเขาไฟไข่กุ้ง (0.41)	Iced Peppermint Chocolate (0.35)	สปาเก็ตตี้โบลองเนสหมูซอสเผ็ดไข่ออนเซ็น (0.27)	Iced Americano (0.23)
Asahi Large L	ข้าวหน้าปลาดิบรวม อโวคาโด (0.43)	สลัดปลาเงิน. (0.38)	หมูสามชั้นย่าง (0.33)	เบคอนพันเห็ดเข็มทอง (0.33)	แซลมอน ซาชิมิ 5 ชิ้น (0.32)
I1 เนื้อไก่ย่างเกลือ	I14ต้นหอมญี่ปุ่นอกไก่ (0.40)	I16หมูสันคอสไลด์ (0.37)	I10ไก่บดทรงเครื่องซอสสไปซี่ (0.36)	I6กึ๋นไก่ย่าง (0.33)	I18หมูสามชั้นสไลด์ (0.31)
I16หมูสันคอสไลด์	I18หมูสามชั้นสไลด์ (0.79)	I15สะโพกไก่ย่าง (0.62)	Montepulciano (0.49)	I17ตับหมู (0.43)	I9ไก่บดทรงเครื่องเทอริยากิ (0.42)
I17ตับหมู	I18หมูสามชั้นสไลด์ (0.47)	I14ต้นหอมญี่ปุ่นอกไก่ (0.46)	I16หมูสันคอสไลด์ (0.43)	matcha (0.41)	Lemon tea (0.41)
Matcha Honey	ไข่เจียวฟูปลาแซลมอน (0.30)	Thai Milk Tea Frappe (0.25)	Iced Matcha Latte (0.24)	I10ไก่บดทรงเครื่องซอสสไปซี่ (0.24)	หนังปลาแซลมอนทอดกรอบ (0.22)
ไก่ทอดอาม่า	Iced Mocha (0.42)	สเต็กเนื้อ (0.34)	สปาเก็ตตี้ไวท์ซอสสไปซี่ปูอัดไข่กุ้ง (0.32)	สปาเก็ตตี้ไก่กรอบคั่วพริกเกลือ (0.29)	สปาเก็ตตี้ไวท์ซอสครีมไข่กุ้ง (0.26)
Iced Butterfly Pea Honey Lemon	สปาเก็ตตี้ไก่กรอบผัดพริกขี้หนูสวน (0.48)	สปาเก็ตตี้โบลองเนสหมูซอสเผ็ด (0.47)	สปาเก็ตตี้ปลาแซลมอนคั่วพริกเกลือ (0.26)	Strawberry Yogurt Smoothie (0.25)	Iced Kiwi Soda (0.19)
Iced Honey Milk	Honey Lemon Espresso (0.56)	I5ตับไก่ย่าง (0.43)	Iced Kiwi Soda (0.42)	เค้กช๊อกโกแลต (0.35)	ข้าวซูชิปลาแซลมอนสด อโวคาโด (0.34)
คาลามารี	สปาเก็ตตี้โบลองเนสซอสเผ็ดแฮมชีส (0.37)	สปาเก็ตตี้หอยลายผัดพริกกระเทียม (0.34)	สปาเก็ตตี้คาโบนาร่าซอสเผ็ดหอยเชลล์ไข่กุ้ง (0.33)	Fresh Passion Fruit Frappe (0.23)	โรลปลาไหลย่างอโวคาโด. (0.22)
อาหารเช้ากริลล์ผักรวมและไข่ข้น	Earl gray tea (0.32)	Toast brcad 2 (0.23)	Bacon (0.23)	คัปปุชชีโนร้อน (0.23)	Hot Americano (0.21)
Asahi Large M	โรลแซลมอนสไปซี่พ่นไฟ. (0.50)	เต้าหู้ตุ๋นหัวปลาแซลมอนซีอิ๊วญี่ปุ่น (0.32)	โรลแซลมอนพ่นไฟ ซอสไซเกียว. (0.28)	สปาเก็ตตี้หอยลายผัดพริกกระเทียม (0.27)	สปาเก็ตตี้สาหร่ายไข่กุ้ง (0.21)
Yuzu Panna Cotta	Banofee Cake (0.52)	สปาเก็ตตี้ไวท์ซอสสไปซี่ปูอัดไข่กุ้ง (0.32)	Strawberry Panna Cotta (0.32)	เค้กแฮมมิ่งเบริด์ (0.32)	Chocolate Frappe (0.32)
โทสต์อาโวคาโด	โทสต์ไข่เบเนดิกต์ (0.45)	Hot Cappuccino (0.37)	Caramel Macchiato Frappe (0.36)	Fresh Passion Fruit (0.36)	ยำผลไม้ (0.27)
สปาเก็ตตี้ไวท์ซอสครีมเห็ด	มันบด (0.45)	Fresh Passion Fruit (0.32)	Kiwi & Passion Fruit (0.32)	อาหารเช้าไข่ข้นและแชมปิฌอง (0.21)	ผักโขมอบชีส (0.18)
Iced Latte	สปาเก็ตตี้ไส้กรอกผัดพริกขี้หนูสวน (0.94)	Yuzu Soda Flower (0.06)	Brooklyn Shake (0.06)	ไข่เจียวฟูปลาแซลมอน (0.06)	Ice americano (0.06)
สปาเก็ตตี้ไวท์ซอสครีมเห็ดแชมปิยองแฮม	Strawberry soda (0.46)	orange soda (0.46)	Kiwi soda (0.46)	ข้าวผัดซอสสไปซี่หมูเกาหลี (0.42)	สปาเก็ตตี้เพสโต้กุ้ง (0.33)
Banafee	Cold Earl Gray Tea (1.00)	พิเษศ กุ้ง (0.83)	สลัดเห็ดย่าง. (0.62)	Iced Honey Black Coffee (0.43)	Iced Matcha Latte (0.18)
Hot Chocolate	โทสต์ไข่ข้นเห็ดแชมปิญอง (0.24)	สปาเก็ตตี้ขี้เมาไก่กรอบ (0.22)	Hot Latte (0.12)	อาหารเช้าไข่ข้นและแชมปิฌอง (0.09)	ซุปผักโขม (0.06)
Honey Lemon	ข้าวหน้าเนื้อ นิกุด้ง. (0.51)	P5. ซุปไวท์ครีมเห็ด (0.48)	P18. สปาเก็ตตี้ไวท์ซอสครีมไข่กุ้ง (0.32)	Iced Matcha Latte (0.27)	Iced Thai Milk Tea (0.26)
I14ต้นหอมญี่ปุ่นอกไก่	I6กึ๋นไก่ย่าง (0.56)	I10ไก่บดทรงเครื่องซอสสไปซี่ (0.51)	I9ไก่บดทรงเครื่องเทอริยากิ (0.50)	I17ตับหมู (0.46)	I13ไก่บดทรงเครื่องพริกรายู (0.43)
I18หมูสามชั้นสไลด์	I16หมูสันคอสไลด์ (0.79)	I15สะโพกไก่ย่าง (0.61)	Montepulciano (0.57)	I9ไก่บดทรงเครื่องเทอริยากิ (0.48)	I17ตับหมู (0.47)
I7หัวใจไก่ย่าง	สปาเกตตี้ทรัฟเฟิลหอยเชลล์ (0.70)	La Piuma (0.70)	ปูอัดซาชิมิ (0.70)	Cranberry Chocolate Cake (0.59)	สปาเก็ตตี้ภูเขาไฟไข่กุ้ง (0.34)
กุ้งฝอยทอดกรอบ.	hot Water (0.43)	Iced Matcha Latte (0.28)	pannacotta (0.26)	บูตะผัดซอสสไปซี่ (0.26)	I17ตับหมู (0.24)
ข้าวซูชิแซลมอน~ปลาฮามาจิ~ปลาทูน่า	Singha Large (0.43)	Matcha Refill (0.26)	ข้าวแกงกะหรี่หมูทอดทงคัตสึ. (0.25)	I9ไก่บดทรงเครื่องเทอริยากิ (0.24)	แซลมอนซัลซ่ายูสุ (0.23)
ข้าวโพดหวานผัดเนย	ยำปลาแซลมอนสด. (0.64)	เฟรนฟรายด์ ทาทาร์มาโย (0.20)	เกี๊ยวซ่า 6 ชิ้น (0.18)	โรลแซลมอนสด. (0.16)	โรล Maki กุ้งเทมปุระ (0.14)
ซูชิแชลมอนทาร์ทาร์	กุ้งเทมปุระ. (0.69)	I9ไก่บดทรงเครื่องเทอริยากิ (0.17)	ข้าวหน้าเนื้อสไลด์ออสเตรเลียตุ๋นไข่. (0.13)	I18หมูสามชั้นสไลด์ (0.12)	I16หมูสันคอสไลด์ (0.11)
ถั่วแขกผัดซอสโชยุ	กึ๋นไก่ย่าง (0.74)	กุ้งทอดคั่วพริกเกลือ. (0.65)	ราเมงไก่ทอดคาราเกะ. (0.48)	ไก่ย่างเกลือ (0.37)	Hot Matcha (0.32)
ยำสาหร่ายวากาเมะ.	โรลกุ้งเทมปุระ. (0.45)	i16หมูสันคอสไลด์ (0.31)	Yuzu Soda (0.28)	i15 สะโพกไก่ (0.25)	i18หมูสามชั้นสไลด์ (0.25)
ราเมงบูตะสันคอสไลด์.	โรล Maki กุ้งเทมปุระ (0.30)	ข้าวผัดสไปซี่ซีฟู้ดไข่ข้นปลาแซลมอนย่าง (0.23)	โรลแซลมอนพ่นไฟ เมนไตโกะ (0.21)	ราเมงบูตะชาชู. (0.19)	Matcha Refill (0.19)
โรล Maki กุ้งเทมปุระ	strawberry milk (0.35)	lemon black tea (0.32)	lemon honey soda (0.32)	lemon honey (0.32)	โรลแซลมอนสด. (0.31)
I2เนื้อไก่ย่างวาซาบิ	Asahi (0.57)	I6กึ๋นไก่ย่าง (0.50)	I14ต้นหอมญี่ปุ่นอกไก่ (0.40)	ปลาแซลมอนสดดองซีอิ้วญี่ปุ่น (0.39)	Fresh Passion Fruit Frappe (0.33)
